,Unnamed: 0,index,City,"Upload Date
 (MM/DD/YYYY)",Upload Time (CET),Local incident date (MM/DD/YYYY),Hyperlink,Latitude,Longitude,Type of Violation,Brief description of incident,date,date_index,cluster,focusX,focusY,x1,y1,x2,y2,x3,y3
0,0,0,"Columbus, OH, USA",05/29/2020,03:45:00,,https://m.facebook.com/story.php?story_fbid=1137997739900780&id=100010716946743&_rdr,39.9652951,-83.019963,Pepper Spray,"protest descends into chaos as a guy jawboning at a cop is violently shoved, another cop comes up to indiscriminately pepper-spray everyone, and then the cops attack. Notice them pepper-spray the guy recording, at the end. [FB @ https://m.facebook.com/story.php?story_fbid=1137997739900780&id=100010716946743&_rdr]",29/05/2020,0,0,39.96276093,-82.99629211,760.0673696699229,266.5494855063483,90.59813201401413,454.0846420464959,0.0,0.0
1,1,1,"Minneapolis, MN, USA",05/29/2020,03:57:00,5/29/2020,https://twitter.com/stribrooks/status/1266186985041022976,44.979727000000004,-93.272487,Pepper Spray,Civilians are indiscriminately sprayed with pepper spray from the window of  Minneapolis police SUV driving by.,29/05/2020,0,1,44.97748566,-93.26436615,603.6122501988763,141.3615909712174,71.23001691755827,461.7777557249332,0.0,0.0
2,2,2,"Atlanta, GA, USA",05/30/2020,00:33:00,5/29/2020,https://twitter.com/Brittm_tv/status/1266497944796225538,33.7572575,-84.3944795,Physical Assault,A police officer with a bicycle uses the bicycle to push over an unarmed civilian.,30/05/2020,1,2,33.748546600000005,-84.39150238,736.7827898237165,434.13280868715424,490.07005508874335,220.11193364402706,0.0,0.0
3,3,3,"New York City, NY, USA",05/30/2020,01:38:00,5/29/2020,https://twitter.com/j0ncampbell/status/1266514356071735296,40.683405,-73.976917,Physical Assault,A number of civilians were beaten by police officers with batons.,30/05/2020,1,3,40.71304703,-74.00723267,968.7990338496754,187.46100771752023,408.64393229221747,169.54796315613157,0.0,0.0
4,4,4,"New York City, NY, USA",05/30/2020,02:38:00,5/29/2020,https://twitter.com/JasonLemon/status/1266529475757510656,40.683244,-73.977563,Physical Assault,"An unarmed civilian is shoved to the curb by a police officer, prompting a seizure that puts the civilian in the emergency room.",30/05/2020,1,3,40.71304703,-74.00723267,1000.5563458420247,318.6013826950839,378.46525313266255,150.42264107554655,0.0,0.0
5,5,5,"New York City, NY, USA",05/30/2020,03:11:00,5/29/2020,https://twitter.com/NickAtNews/status/1266537738364477446,40.6859999,-73.9594372,Physical Assault,Police driving by open passenger side door into an unarmed civilian standing in the non-vehicular bike lane.,30/05/2020,1,3,40.71304703,-74.00723267,921.5017891350898,215.24952952504609,406.8233142238031,218.42158161897643,0.0,0.0
6,6,6,"Houston, TX, USA",05/30/2020,03:14:00,5/29/2020,https://twitter.com/vikthewild/status/1266538354939756544?s=20,29.755111,-95.36758499999999,Physical Assault,A civilian is trampeled by a patrol officer's horse.,30/05/2020,1,4,29.76080322,-95.36950684,568.5871301128086,514.4686958107717,392.0273132079468,112.1696891012332,0.0,0.0
7,7,7,"Omaha, NE, USA",05/30/2020,03:58:00,,https://twitter.com/jonnykip21/status/1266549545581895680,41.259892,-96.027672,Less Lethal Round,Police officers fire less lethal rounds and physically assault individuals sitting on the ground with signs.,30/05/2020,1,5,41.25865173,-95.93719482,547.6122146119517,243.0547094563149,155.83509423645611,201.52325198904745,0.0,0.0
8,8,8,"Houston, TX, USA",05/30/2020,04:41:00,,https://twitter.com/DomSkyeRN/status/1266557890120335362,29.76080322,-95.36950684,Physical Assault,Officer headbutts phone out of individual's hand as they are filming another civilian being arrested.,30/05/2020,1,4,29.76080322,-95.36950684,585.963746350603,500.9972541884733,395.9656379789108,258.23752163855636,0.0,0.0
9,9,9,"Las Vegas, NV, USA",05/30/2020,04:44:00,5/29/2020,https://twitter.com/bridgetkbennett/status/1266561128185819136,36.114781799999996,-115.1727395,Physical Assault,Unarmed civilians are beaten by police officers.,30/05/2020,1,6,36.16909027,-115.14057920000002,230.17556446418203,378.1908456881079,375.224198256123,261.20281299782323,0.0,0.0
10,10,10,"Detroit, MI, USA",05/30/2020,04:55:00,5/29/2020,https://twitter.com/joeguillen/status/1266563974658744321,42.3312069,-83.0435312,Physical Assault,"An officer, surrounded by a group of other officers, charges and physically assaults a civilian who is backing away.",30/05/2020,1,7,42.33293915,-83.0478363,794.8129165299725,225.022168313915,465.29701415984925,196.73544881163755,0.0,0.0
11,11,11,"Fort Wayne, IN, USA",05/30/2020,06:02:00,5/29/2020,https://twitter.com/_isabel_a/status/1266580681251000321,41.080529799999994,-85.1391359,Pepper Spray,Unarmed civilians are pepper-sprayed by police officer.,30/05/2020,1,8,41.07747269,-85.13749695,737.417624878626,231.9773968422341,95.19500741576528,434.0283151584545,0.0,0.0
12,12,12,"Dallas, TX, USA",05/30/2020,06:04:00,05/29/2020,https://cbsloc.al/3dlcjkY,32.777146,-96.803426,Tear Gas,"CBS news crew caught in tear gas, individual presenter reports that they have been threatened with arrest.",30/05/2020,1,9,32.77797699,-96.79621124,537.2779826030741,449.05018739761937,726.322970134932,168.12727872176572,0.0,0.0
13,13,13,"Canton, OH, USA",05/30/2020,06:16:00,,https://twitter.com/rinnalaiss/status/1266584257511723009/photo/1,40.79738617,-81.37703705,Tear Gas,"Photograph of militarised police complete with MRAP armoured vehicle, and self-reported shooting of tear gas / being followed.",30/05/2020,1,10,40.79738617,-81.37703705,818.1101357187417,264.373808519132,706.8731237584518,272.8297148744287,0.0,0.0
14,14,14,"New York City, NY, USA",05/30/2020,06:17:00,5/30/2020,https://twitter.com/crankberries/status/1266584559245803522,40.68141,-73.9770777,Physical Assault,An NYPD officer in the white shirt shoves an unarmed civilian onto the ground.,30/05/2020,1,3,40.71304703,-74.00723267,955.4172728365088,339.3564864533531,420.7589836328298,232.95711584149907,0.0,0.0
15,15,15,"Denver, CO, USA",05/30/2020,09:20:00,,https://twitter.com/Mr_Blue_sky_II/status/1266630635956789248,39.739990999999996,-104.98755,Less Lethal Round,Bystanders in car get shot with pepper balls by police officers.,30/05/2020,1,11,39.73845291,-104.9848557,383.1654901078016,263.12388066794364,167.09019149529712,164.6375092603227,0.0,0.0
16,16,16,"Denver, CO, USA",05/30/2020,09:34:00,5/30/2020,https://twitter.com/SaltMagazine_/status/1266634027257098240,39.739643,-104.986167,Less Lethal Round,Civilians are intentionally pepper-sprayed for recording police outside the state's capitol grounds,30/05/2020,1,11,39.73845291,-104.9848557,412.36676816726657,261.40445431098277,179.7744725708762,148.9443704002537,0.0,0.0
17,17,17,"Lincoln, NE, USA",05/30/2020,12:14:00,5/30/2020,https://twitter.com/TheRyanSwanigan/status/1266674265635553284,40.8138047,-96.6851684,Other,Police SUV drives through a group of unarmed civilians attempting to stop the vehicle,30/05/2020,1,12,40.81359863,-96.7026062,550.3793671682068,272.57794593468697,992.6956781784651,490.2202014032128,0.0,0.0
18,18,18,"Minneapolis, MN, USA",05/30/2020,12:19:00,5/29/2020,https://www.facebook.com/1462345700/posts/10220863812572745/?d=n,44.9483222,-93.23409129999999,Other,Police shoot a civilian in the neck with a rubber bullet. They then continue detonating more flash-bang grenades from roof.,30/05/2020,1,1,44.97748566,-93.26436615,633.0630465040883,180.79019690109047,1016.5295233125496,543.7697843743728,0.0,0.0
19,19,19,"Columbus, OH, USA",05/30/2020,20:18:00,5/30/2020,https://twitter.com/KRobPhoto/status/1266796191469252610,39.9620691,-83.00065490000001,Pepper Spray,"Democratic Rep. Joyce Beatty, Columbus City Council President Shannon Hardin and Franklin County Commissioner Kevin Boyce were pepper sprayed by police when trying to deescalate a confrontation between a civilian and police.",30/05/2020,1,0,39.96276093,-82.99629211,778.3078681747952,308.3441753417272,118.12199960025549,482.30078068045304,0.0,0.0
20,20,20,"Columbus, OH, USA",05/30/2020,20:55:00,5/30/2020,https://twitter.com/rottenstrwbry/status/1266805467990446081 ,39.962181799999996,-83.00055079999998,Pepper Spray,"Unarmed civilians were chanting near the intersection N High St & E Broad St when officers started pepper-spraying them. ,

Near the intersection N High St & E Broad St police indiscriminately pepper-spray civilians. Another angle of incident no. 23.",30/05/2020,1,0,39.96276093,-82.99629211,779.096167365348,264.01464516164833,175.36005015844006,521.6888994893703,0.0,0.0
21,21,21,"Harrisburg, PA, USA",05/30/2020,21:34:00,5/30/2020,https://twitter.com/gonzaloaflores/status/1266815380619702273,40.2646231,-76.890304,Pepper Spray,Civilians try to help an individual on the ground to stand up. Police wait until the civilian is halfway up before pepper-spraying the helpers. ,30/05/2020,1,13,40.25959396,-76.88187408,870.1641580703862,263.06754029729865,69.88565604041327,539.6641509626086,0.0,0.0
22,22,22,"Columbus, OH, USA",5/30/2020,21:59:00,,https://twitter.com/lalaitskelcey2/status/1266821476122058752?s=20,39.962149,-83.00013,Pepper Spray,An civilian is walking away down the sidewalk in front of an officer. The officer pepper sprays the civilian from behind. ,30/05/2020,1,0,39.96276093,-82.99629211,818.3395903568985,303.3650607921929,175.6702627356854,479.89050982216196,0.0,0.0
23,23,23,"Columbus, OH, USA",05/30/2020,22:48:00,,https://twitter.com/bwk1992/status/1266833971570237442,39.9621717,-83.00061529999998,Pepper Spray,"protestor gives police the middle finger as they're pepper-spraying people, so another cop speed-walks up to rip the guys mask off so he can be sprayed. [h/t @bwk1992]",30/05/2020,1,0,39.96276093,-82.99629211,770.5546797670179,284.83051182019136,156.23220568994208,499.2395106139781,0.0,0.0
24,24,24,"New York City, NY, USA",05/30/2020,,05/30/2020,https://www.instagram.com/p/CAzSOtGlKQY/,40.6971494,-74.2598655,Physical Assault,NYPD officer flings a civilian into a patrol car with such force that the civilian is knocked out and ends up with a concussion.,30/05/2020,1,3,40.71304703,-74.00723267,1018.5952546707109,234.21717184510507,427.45928239282347,287.55958081287906,0.0,0.0
25,25,25,"Phoenix, AZ, USA",05/30/2020,,05/30/2020,https://twitter.com/PhxProtestLIVE/status/1268390978571825156,33.44820404,-112.07258610000001,Physical Assault,Jonathan Raymond Kantner is walking before he is taken down by a police officer. He yells that he was “going home.” The officer appears to continue pushing him even once he is on the ground and yells for him to “stop resisting” although no resistance is visible on the video.,30/05/2020,1,14,33.44820404,-112.07258610000001,283.7807660067589,431.6342051898949,389.17205279699357,167.9215725148077,0.0,0.0
26,26,26,"Los Angeles, CA, USA",05/30/2020,,05/30/2020,https://www.pscp.tv/w/1OwxWQXvOAjGQ https://twitter.com/tracemeYo/status/1266633586322497538?s=20,34.044748999999996,-118.252297,Less Lethal Round,"A large group of police officers are on South Spring Street near West 7th Street. They appear to be arresting individuals lying down on the sidewalk to the East as well as forming a line across South Spring Street. One of the police officers walks towards the West side of the street and points their gun upwards at the apartment building. The officer shoots at an individual in their apartment with a bean bag round and breaks their window. This officer continues to aim their gun at this spot and is joined by other officers looking upwards, including one that aims their gun at the same spot. Some of the officers begin to shine flash lights up at the apartment building.",30/05/2020,1,15,34.05223846,-118.2433472,153.81630146596225,468.43585777025993,74.54196179406745,190.59954142760662,0.0,0.0
27,27,27,"Cleveland, OH, USA",05/31/2020,00:32:00,,https://twitter.com/Caroline_On_TV/status/1266860020588843008,41.502133,-81.697275,Physical Assault,Police officers assaulting unarmed civilians outside the Justice Centre.,31/05/2020,2,16,41.50554657,-81.6914978,815.7903395185227,221.49248271955142,380.5266282501609,186.44555124012655,0.0,0.0
28,28,28,"Dallas, TX, USA",05/31/2020,00:34:00,05/30/2020,https://twitter.com/calvinwatkins/status/1266860555597500416,32.778501,-96.796433,Tear Gas,Police officers fire at a peaceful crowd.,31/05/2020,2,9,32.77797699,-96.79621124,553.0511618338406,433.7482382075644,686.1156871397712,275.60799707632304,0.0,0.0
29,29,29,"San Jose, CA, USA",05/31/2020,01:16:00,5/29/2020,https://twitter.com/greg_doucette/status/1266871141269987331 ,37.338932799999995,-121.8847294,Intimidation,"An officer shouts ""SHUT UP, BITCH!"" to a civilian, then the police rush everyone. ,

The SJPD officer bounces back and forth, smiling, and licks their lips. ,

Another recording of the same SJPD officer who is heard screaming “let’s get this motherfucker” referring to a civilian. ",31/05/2020,2,17,37.33479309,-121.88814540000001,122.56532809789952,346.0771299593329,349.1799968142497,508.16094849590854,0.0,0.0
30,30,30,"Atlanta, GA, USA",05/31/2020,01:42:00,,https://twitter.com/DanWolken/status/1266877753015570433,33.757878999999996,-84.393564,Arrest/Detention,Photographer arrested by four police officers streamed on nightly news.,31/05/2020,2,2,33.748546600000005,-84.39150238,753.6179851037967,420.1279509382517,973.4701922892689,147.25686361715722,0.0,0.0
31,31,31,"Salt Lake City, UT, USA",05/31/2020,01:43:00,5/31/2020,https://twitter.com/skye_rtin/status/1266877962877460480,40.7605627,-111.88480390000001,Physical Assault,SWAT unit is seen shoving to the ground an older civilian with a walking stick.,31/05/2020,2,18,40.75847626,-111.88814540000001,292.5673063023818,267.0306107842564,324.8690135821377,224.97248657458368,0.0,0.0
32,32,32,"New York City, NY, USA",05/31/2020,02:09:00,5/30/2020,https://twitter.com/chieffymac11/status/1266884475268616197 ,40.679591200000004,-73.9741277,Other,"Civilians holding up a small barricade appear to stop an NYPD SUV from moving forwards. A second NYPD vehicle approaches, and drives through part of the crowd, directly hitting multiple civilians. Then, the first vehicle rams through the civilians holding the barricade, causing them to fall on the ground. , 

Bird's-eye view of incident no. 25.

",31/05/2020,2,3,40.71304703,-74.00723267,937.2490909089261,271.7899038238384,973.2431626209672,500.604794105754,0.0,0.0
33,33,33,"Los Angeles, CA, USA",05/31/2020,02:38:00,,https://twitter.com/roebotwriter/status/1266891873710305280,34.05223846,-118.2433472,Less Lethal Round,"Police fire rubber bullets into a crowd with minors, without warning or telling to disperse. ",31/05/2020,2,15,34.05223846,-118.2433472,141.00223751615627,402.9495233269188,100.5210126031298,251.5341014046129,0.0,0.0
34,34,34,"Minneapolis, MN, USA",05/31/2020,02:45:00,,https://twitter.com/UR_Ninja/status/1267074770576838658,44.94660800000001,-93.279706,Intimidation,Police officers threaten journalists verbally from across road.,31/05/2020,2,1,44.97748566,-93.26436615,603.5091433609161,182.4966344061699,408.3857128004849,550.1066406226773,0.0,0.0
35,35,35,"Raleigh, NC, USA",05/31/2020,02:46:00,5/30/2020,https://twitter.com/BarkyBoogz/status/1266893772060790784,35.7756153,-78.6393255,Tear Gas,"An day-long peaceful protest, named ""A National Day of Action"" ends with police firing tear gas into the crowd.",31/05/2020,2,19,35.78130341,-78.64167786,863.3522791377211,407.0329843101435,715.8943650594221,128.25221881012578,0.0,0.0
36,36,36,"Seattle, WA, USA",05/31/2020,02:52:00,5/30/2020,https://twitter.com/hallealicee/status/1266895207007547392?s=20,47.611569,-122.33801399999999,Pepper Spray,A child is pepper-sprayed by police officers.,31/05/2020,2,20,47.60322952,-122.3302765,53.20676630883916,65.66740701657422,61.959248359832415,485.0811661866697,0.0,0.0
37,37,37,"Chicago, IL, USA",05/31/2020,03:01:00,5/30/2020,https://twitter.com/JCB_Journo/status/1266897672545480706,41.891642,-87.629196,Pepper Spray,"Police officers use pepper-spray on moving civilians, including a reporter identifying himself as press.",31/05/2020,2,21,41.8832283,-87.63240051,703.3330760115563,208.62717272082497,133.38291085440767,555.149334896066,0.0,0.0
38,38,38,"Los Angeles, CA, USA",05/31/2020,03:14:00,05/30/2020,https://twitter.com/MatthewSantoro/status/1266916709304201216?s=20,34.07087,-118.35641499999998,Less Lethal Round,"Crowd of individuals walking backwards with arms raised shouting ""Don't shoot"". Large group of police officers approaches at aprox. 70m distance, first walking then running towards the individuals, who, in turn, run away. Police officers start to shoot fleeing individuals with rubber bullets. Sound of one larger explosion ",31/05/2020,2,15,34.05223846,-118.2433472,128.758280000595,451.84289440546587,104.30150247699062,217.33246657727167,0.0,0.0
39,39,39,"Orlando, FL, USA",05/31/2020,03:18:00,,https://twitter.com/alexandersbde/status/1266901722410168321,28.5391145,-81.37899490000002,Pepper Spray,Indiscriminate use of pepper-spray by police.,31/05/2020,2,22,28.53833008,-81.37887573,839.4311961801758,542.0377874437875,114.65774314342322,441.4958794402328,0.0,0.0
40,40,40,"New York City, NY, USA",05/31/2020,03:23:00,,https://twitter.com/letsgomathias/status/1266903135303450631,40.650534,-73.955939,Intimidation,"Police officer pushes over barricade into civilians, and then runs at civilians on the other side. ",31/05/2020,2,3,40.71304703,-74.00723267,915.1992947579275,235.43688933656057,411.3945416035333,436.2523627941048,0.0,0.0
41,41,41,"Los Angeles, CA, USA",05/31/2020,03:37:00,,https://twitter.com/andrewcurryla/status/1266906677820833793,34.0716005,-118.361296,Less Lethal Round,"Police officers shoot civilians shot in the head. Per the journalist who got the video, police shot first, and then gave order to disperse.",31/05/2020,2,15,34.05223846,-118.2433472,135.7611438799525,431.0874377475327,84.22027675419103,221.09334719635777,0.0,0.0
42,42,42,"Minneapolis, MN, USA",05/31/2020,03:39:00,,https://twitter.com/MSNBC/status/1266913892334174208,44.962738,-93.277813,Tear Gas,Police officers shoot teargas (and less lethal rounds?) at a reporter live on air. Reporter says that they had done the same to a peaceful crowd gathered minutes before the footage was taken.,31/05/2020,2,1,44.97748566,-93.26436615,595.7800531911408,161.89370463840027,657.0299096502796,196.25159935623495,0.0,0.0
43,43,43,"Atlanta, GA, USA",05/31/2020,03:46:00,,https://twitter.com/KCJ_Swish/status/1266913464234237954,33.759665999999996,-84.392075,Arrest/Detention,"Two civilians (college students) in a car, which is stopped by police - both of them are tasered and dragged out, glass on car is broken.",31/05/2020,2,2,33.748546600000005,-84.39150238,747.8733820392955,398.9269734328013,1040.1305315829288,142.4283230650837,0.0,0.0
44,44,44,"New York City, NY, USA",05/31/2020,03:47:00,,https://twitter.com/orsification/status/1266909241820004353,40.728552799999996,-73.9906947,Physical Assault,"Bicyclist officer abruptly arrested a civilian without cause, as at least two officers beat the civilian.",31/05/2020,2,3,40.71304703,-74.00723267,946.8328053820642,242.69056119315033,450.60596683404276,210.18781416552653,0.0,0.0
45,45,45,"Philadelphia, PA, USA",05/31/2020,04:04:00,5/30/2020,https://twitter.com/UR_Ninja/status/1266913490301792257,39.95106125,-75.1656189,Arrest/Detention,Police officers arresting an unarmed civilian. An officer hits reporter's camera with baton and tells the reporter to go away.,31/05/2020,2,23,39.95106125,-75.1656189,877.8388685952061,300.30859109804595,945.4178540775079,202.8815675885071,0.0,0.0
46,46,46,"Minneapolis, MN, USA",05/31/2020,04:28:00,,https://twitter.com/MikeGeorgeCBS/status/1266919447970942986,44.948586,-93.278614,Less Lethal Round,Police officers fire less lethal rounds at reporters not standing near protestors. Sound engineer is shot in the arm.,31/05/2020,2,1,44.97748566,-93.26436615,617.4263392529073,165.4062003957742,74.24107630086216,239.01824414274128,0.0,0.0
47,47,47,"Minneapolis, MN, USA",05/31/2020,04:37:00,5/30/2020,https://twitter.com/tkerssen/status/1266921821653385225,44.9555257,-93.2874523,Other,"National Guard and Minneapolis PD officers demand civilians to stop filming from the porch of their house and to go inside. Heard on the twitter video is ""Light 'em up!"" as they then shoot a paint cannisters at the people standing on their own porch.",31/05/2020,2,1,44.97748566,-93.26436615,580.8301359776801,177.98309756538998,976.0330704492394,438.6841158413652,0.0,0.0
48,48,48,"Minneapolis, MN, USA",05/31/2020,04:52:00,5/30/2020,https://twitter.com/jaybeware/status/1266925550242869252?s=20,44.963062,-93.277773,Arrest/Detention,Police officers in Minneapolis shoot at and arrest a reporter after the reporter repeatedly verbally identifies themselves and is walking away.,31/05/2020,2,1,44.97748566,-93.26436615,579.0977203623577,147.63614364173708,939.8953401124339,226.5431003827157,0.0,0.0
49,49,49,"Los Angeles, CA, USA",05/31/2020,05:12:00,5/30/2020,https://twitter.com/sleepydayhana/status/1266930544811671552,34.071690000000004,-118.36198799999998,Physical Assault,"Police officers hitting civilians repeatedly with batons, and arresting one.",31/05/2020,2,15,34.05223846,-118.2433472,176.00844636369996,413.45891434552925,357.84836063259655,148.0983362005758,0.0,0.0
50,50,50,"Columbus, OH, USA",05/31/2020,05:30:00,5/30/2020,https://twitter.com/budjoon/status/1266935071187054593,39.96214000000001,-83.000509,Pepper Spray,Officer pepper-sprays civilians sitting on the ground.,31/05/2020,2,0,39.96276093,-82.99629211,802.9583008454917,324.61088174872833,74.54304477967025,441.2126517410511,0.0,0.0
51,51,51,"Los Angeles, CA, USA",05/31/2020,05:31:00,,https://twitter.com/MattMcGorry/status/1266935305010987008,34.071928,-118.362834,Less Lethal Round,Police officers shoot individuals holding hands up with less lethal rounds.,31/05/2020,2,15,34.05223846,-118.2433472,103.24594234247462,404.7167466756875,135.87258456050748,200.24835762219362,0.0,0.0
52,52,52,"New York City, NY, USA",05/31/2020,05:34:00,,https://twitter.com/keithboykin/status/1266936136418701317,40.796199,-73.975374,Arrest/Detention,Police officers arrest a reporter and held him for six hours. (No video),31/05/2020,2,3,40.71304703,-74.00723267,945.6304409967958,188.50394605166093,946.2679651613448,157.55778623883273,0.0,0.0
53,53,53,"New York City, NY, USA",05/31/2020,05:36:00,5/30/2020,https://twitter.com/HuffPost/status/1266936484692725766,40.650749,-73.9511,Arrest/Detention,Police officers arrest a journalist with his press pass on clear display.,31/05/2020,2,3,40.71304703,-74.00723267,917.7625637323321,265.8407383570646,1029.8498128217143,263.30689814257386,0.0,0.0
54,54,54,"Atlanta, GA, USA",05/31/2020,05:49:00,,https://twitter.com/ANGELCUCCl/status/1266939757252280321,33.75977,-84.391009,Arrest/Detention,Police officers forcefully arrest and assault two civilians.,31/05/2020,2,2,33.748546600000005,-84.39150238,769.6557425984499,401.6747124221192,973.8800621529373,250.97324857369765,0.0,0.0
55,55,55,"Denver, CO, USA",05/31/2020,06:11:00,5/30/2020,https://twitter.com/tessrmalle/status/1266945413258653696,39.735144,-104.981076,Physical Assault,Police officer pushes a civilian to the ground very near an open fire.,31/05/2020,2,11,39.73845291,44.4,424.66949988233057,304.78413410099614,338.9600737855345,247.06523448744193,0.0,0.0
56,56,56,"Raleigh, NC, USA",05/31/2020,06:23:00,5/30/2020,https://twitter.com/LiamCurrie16/status/1266948510022320130,35.7781455,-78.63502120000003,Other,An earlier separate section of Raleigh NC police shooting pepperballs into peaceful and unarmed civilians.,31/05/2020,2,19,44.4,44.4,877.3130718555932,391.8047829285205,995.6390426787032,448.69419661602956,0.0,0.0
57,57,57,"Chicago, IL, USA",05/31/2020,06:43:00,5/31/2020,https://twitter.com/johncusack/status/1266953514242228229,41.892594,-87.625403,Physical Assault,Civilian filming burning police car attacked by police officers with batons.,31/05/2020,2,21,44.4,44.4,722.4532869424521,218.38983640605164,341.3683624283355,186.96708167964124,0.0,0.0
58,58,58,"Seattle, WA, USA",05/31/2020,07:09:00,5/31/2020,https://twitter.com/mattmillsphoto/status/1266960081389629440,47.611955,-122.33521999999999,Arrest/Detention,Police officers arrest a civilian with knee on neck.,31/05/2020,2,20,44.4,44.4,40.01697338418535,88.34900529770151,967.8384370610358,201.8693400001452,0.0,0.0
59,59,59,"Fort Wayne, IN, USA",05/31/2020,07:14:00,,https://twitter.com/LeslieR36377569/status/1266961299084369920,41.080057000000004,-85.138227,Tear Gas,Civilian shot in the face with a tear gas cannister which resulted in the later loss of their eye.,31/05/2020,2,8,44.4,44.4,757.9835533794139,227.72404319086274,745.1538371672611,205.54316458056212,0.0,0.0
60,60,60,"Salt Lake City, UT, USA",05/31/2020,07:22:00,05/30/2020,https://www.instagram.com/p/CA148-0B14t6mQZqJZYzwq25KdoPzZ5CJmV3oQ0/,40.760411,-111.885127,Less Lethal Round,Police officer shoots a civilian at point blank range.,31/05/2020,2,18,44.4,44.4,271.3247688829721,272.7742027799639,86.54792652335571,278.92086732697175,0.0,0.0
61,61,61,"New York City, NY, USA",05/31/2020,07:34:00,,https://twitter.com/PNickCurran/status/1266966295653777408,40.650721999999995,-73.95107900000002,Arrest/Detention,Police officer pins down a civilian who is obviously a street medic to arrest them. Officers chase people who are filming.,31/05/2020,2,3,44.4,44.4,993.0814104481378,298.79921008170663,1007.3842134143072,253.65962910313948,0.0,0.0
62,62,62,"Santa Ana, CA, USA",05/31/2020,07:51:00,05/30/2020,https://twitter.com/WoeSoros/status/1266985719932661760?s=20,33.74973679,-117.86978149999999,Less Lethal Round,An individual appears wounded and people nearby call for a medic while trying to help the person. A row of police officers approaches and opens fire at the group of people. ,31/05/2020,2,24,44.4,44.4,206.929981204284,376.92396306441475,103.27249779567038,166.53148985703146,0.0,0.0
