63,63,63,"Erie, PA, USA",05/31/2020,09:06:00,05/31/2020,https://twitter.com/the7goonies/status/1266989439160590336,42.129951,-80.085441,Pepper Spray,Police officers pepper spray a civilian sitting on the ground and kick them over.,31/05/2020,2,25,44.4,44.4,836.6566410079117,215.54733166475194,156.68762523482224,540.4650348910116,0.0,0.0
64,64,64,"Manassas, VA, USA",05/31/2020,09:25:00,,https://twitter.com/tristanshields/status/1266994214878932993,38.787728,-77.513806,Pepper Spray,Police officer pushes over an civilian who is a member of the General Assembly. Said member is later sprayed with pepper spray.,31/05/2020,2,26,44.4,44.4,838.3023450159824,298.3110901149351,154.5649155729506,519.6562134031445,0.0,0.0
65,65,65,"Sacramento, CA, USA",05/31/2020,11:45:00,,https://twitter.com/chadloder/status/1267029301389492224,38.582879,-121.49828799999999,Less Lethal Round,Young civilian carried through crowd bleeding extensively from the face - reportedly been shot in the face by a less lethal round.,31/05/2020,2,27,44.4,44.4,109.86972450566437,283.8953972043752,54.42248671344963,200.48811741092248,0.0,0.0
66,66,66,"Louisville, KY, USA",05/31/2020,11:45:00,05/30/2020,https://twitter.com/greg_doucette/status/1266889425298108421,38.22533035,-85.74169922,Other,"Officers appear to take medical supplies, and destroy others, as other officers push protesters back to stop them from recording.",31/05/2020,2,28,44.4,44.4,744.7774515526839,353.09367577064415,1015.7672354105557,443.00163419029764,0.0,0.0
67,67,67,"La Mesa, CA, USA",05/31/2020,11:49:00,,https://twitter.com/mamitbh/status/1267030342243778561?s=20,32.766794,-117.02299599999999,Tear Gas,Police is seen protecting the entrance of a building. For no obvious reason they start shooting BB guns at unarmed civilians and right after they deploy flashbang grenades and tear gas. The crowd is dispersed and one civilian is seen falling to the ground.,31/05/2020,2,29,44.4,44.4,219.5040870103214,455.7963362486142,618.2447994965069,182.9525823819261,0.0,0.0
68,68,68,"New York City, NY, USA",05/31/2020,15:13:00,05/30/2020,https://twitter.com/AJRupchandani/status/1267081875190923266,40.646629,-73.955632,Pepper Spray,Police officer pulls down an civilian's mask and pepper-sprays them in the face.,31/05/2020,2,3,44.4,44.4,976.5103596640604,336.0425896309977,177.09038010006986,500.8054389789703,0.0,0.0
69,69,69,"Columbus, OH, USA",05/31/2020,16:34:00,,https://twitter.com/MediocRae/status/1267102263023198211,39.963347999999996,-82.991001,Less Lethal Round,Two demonstrators standing with signs some distance from police officers shot with less than lethal rounds.,31/05/2020,2,0,44.4,44.4,811.6762298902263,284.51594521994093,146.2592404924921,275.2802481319045,0.0,0.0
70,70,70,"Akron, OH, USA",05/31/2020,16:43:00,,https://reddit.com/r/Ohio/comments/gtr6p3/cops_gassing_the_protest_on_high_st_and_exchange,41.0760202,-81.5211042,Tear Gas,A group officers move toward two individuals from across a street and shoot a tear gas canister at them.,31/05/2020,2,30,44.4,44.4,815.9274752161552,243.3768979181006,758.6104363205817,242.2207126633669,0.0,0.0
71,71,71,"Dallas, TX, USA",05/31/2020,17:02:00,5/31/2020,https://twitter.com/greg_doucette/status/1267109272342736896,32.77797699,-96.79621124,Less Lethal Round,Individual bystander shot in the face with a less-than-lethal round.,31/05/2020,2,9,44.4,44.4,558.5156670534311,454.95899775582865,130.7863075503653,291.2886212297671,0.0,0.0
72,72,72,"Austin, TX, USA",05/31/2020,17:13:00,,https://twitter.com/jayjanner/status/1267111893753307137,30.267774,-97.734532,Less Lethal Round,Pregnant civilian hit in the stomach with a less than lethal round.,31/05/2020,2,31,44.4,44.4,505.62960723312324,464.1622616220602,119.81241728137077,252.39601325710777,0.0,0.0
73,73,73,"Austin, TX, USA",05/31/2020,17:38:00,05/30/2020,https://twitter.com/Ironfront7/status/1267133400156196870?s=20,30.267676,-97.734239,Less Lethal Round,Crowd of people is assembled in front of the APD (Austin Police Department) building with police officers lined up in front of the building. A total of 9 rubber bullet shots can be heard during the 42 seconds video. Some police officers can be seen shooting twith rubber guns at the crowd while one police officer sprays a pepper spray at the nearest assembled people. ,31/05/2020,2,31,44.4,44.4,519.864337453694,505.8100973123127,26.384405457073846,230.03800553311774,0.0,0.0
74,74,74,"San Antonio, TX, USA",05/31/2020,18:05:00,,https://twitter.com/chadloder/status/1267124991809609728,29.426006,-98.488702,Less Lethal Round,"Police officer shoots civilian recording and shooting at them twice with less lethal rounds, which hit in the arm and leg.",31/05/2020,2,32,44.4,44.4,504.3541564962941,521.2857364662009,119.1003392486452,117.64868174484387,0.0,0.0
75,75,75,"San Diego, CA, USA",05/31/2020,18:43:00,,https://twitter.com/SaudiaSakari/status/1267134500087062528,32.71575928,-117.16381840000001,Less Lethal Round,"Police shoot an unarmed civilian using a non lethal round, between the eyes.",31/05/2020,2,33,44.4,44.4,192.64762714845682,489.97746472164556,119.1741575469061,138.57801520675497,0.0,0.0
76,76,76,"Denver, CO, USA",05/31/2020,19:02:00,,https://twitter.com/heyydnae/status/1267139396278661121,39.738951,-104.99027,Less Lethal Round,Police officer shoots civilian recording them with pepperball.,31/05/2020,2,11,44.4,44.4,378.1482508193925,286.33749477572246,146.95318452395026,162.87409455898865,0.0,0.0
77,77,77,"Austin, TX, USA",05/31/2020,19:33:00,,https://twitter.com/wanderingwoook/status/1267147121347694597?s=20,30.267663,-97.734187,Less Lethal Round,"Police shoot an unarmed pregnant civilian, rush over to where they are receiving medical attention – then, after they remove the person, start shooting all the other unarmed civilians. Reports suggest that due to being shot, the person had a miscarriage. ",31/05/2020,2,31,44.4,44.4,548.3688285386448,506.01106337486647,101.72671606518566,127.76444699354717,0.0,0.0
78,78,78,"New York City, NY, USA",05/31/2020,21:59:00,,https://twitter.com/brandon212_/status/1267184037547986944,40.688732,-73.9802,Physical Assault,Police officers chase after and physically assault protestors.,31/05/2020,2,3,44.4,44.4,1015.8375851619654,274.09655274085236,435.64630581122356,197.30989862614217,0.0,0.0
79,79,79,"La Mesa, CA, USA",05/31/2020,22:51:00,05/30/2020,https://twitter.com/SDUTdyer/status/1267212161140416512?s=20,32.767521,-117.02253,Less Lethal Round,Police officer is seen shooting at individuals across a busy street. The type of munition is unclear. It could be rubber bullets or bean bag rounds. ,31/05/2020,2,29,44.4,44.4,231.1158318342992,436.51841426491836,40.851902647941884,168.58653858045872,0.0,0.0
80,80,80,"Philadelphia, PA, USA",05/31/2020,23:01:00,,https://twitter.com/cynthiaschemmer/status/1267199590987714560,39.95580800000001,-75.225714,Tear Gas,Police officers shooting tear gas down empty residential streets.,31/05/2020,2,23,44.4,44.4,890.7458203989894,267.1214431056778,717.1568607256148,200.79310156534635,0.0,0.0
81,81,81,"Richmond, VA, USA",05/31/2020,23:39:00,05/31/2020,https://m.facebook.com/story.php?story_fbid=1123349158037544&id=100010874104187 ,37.550311,-77.449465,Pepper Spray,"Police officers fire pepper-spray into a civilian's apartment to stop the person from recording them. , 

Same police officers as 60 above spray group of civilians walking home with pepper spray.",31/05/2020,2,34,44.4,44.4,904.0710569841995,359.1150865739822,99.25487750378436,491.5611739217778,0.0,0.0
82,82,82,"New York City, NY, USA",5/31/2020,no,,https://www.instagram.com/p/CA1C-46BHxA/?igshid=1cr74ngn0f84k,40.682646500000004,-73.9776096,Pepper Spray,Police pepper-spray and handcuff NYC Senator Zellnor Y. Myrie and Assemblywoman Diana C. Richardson,31/05/2020,2,3,44.4,44.4,979.1617020109936,314.0537094529275,78.86878854761345,521.0555394980403,0.0,0.0
83,83,83,"Los Angeles, CA, USA",05/31/2020,,,https://www.youtube.com/watch?v=sUbNNopu1ts&feature=youtu.be,34.076094899999994,-118.35634070000002,Tear Gas,"An extended montage (15+ minutes) by independent journalist Tina-Desiree Berg of tear gas and ""less than lethal rounds"" deployed against protestors in Los Angeles.",31/05/2020,2,15,44.4,44.4,144.80783139392008,381.88647744319485,624.1454280850141,208.384895969637,0.0,0.0
84,84,84,"Lansing, MI, USA",05/31/2020,,,https://www.youtube.com/watch?v=0Oq1h1MwYC0&feature=youtu.be ,42.7296776,-84.5522765,Tear Gas,"Police fire teargas from an entire block away.

Continuation of the incident above.",31/05/2020,2,35,44.4,44.4,761.2199722348308,199.19462994990454,688.7961836244634,255.07350146201702,0.0,0.0
85,85,85,"Chicago, IL, USA",05/31/2020,,,https://twitter.com/HeatherCherone/status/1269004849477300225,41.7995763,-87.5895691,Physical Assault,The police attacked a protest bystander and hit their leg with a baton five times. ,31/05/2020,2,21,44.4,44.4,708.7183988354094,252.61274329365833,374.9601833992578,281.74718065855546,0.0,0.0
86,86,86,"Chicago, IL, USA",05/31/2020,,,"https://twitter.com/CHICAGOCREATUR1/status/1268607315902697478

https://twitter.com/dudgedudy/status/1269087238824083456

https://twitter.com/ConradKlek/status/1269088318014328833",41.8645066,-87.6581821,Other,Chicago PD officers do not have their bodycams and have deliberately covered their name plates to avoid identification and evade internal accountability regulations. Additional examples attached.,31/05/2020,2,21,44.4,44.4,670.0349099451178,236.72258657372478,958.3646593355497,467.6260371560793,0.0,0.0
87,87,87,"Denver, CO, USA",05/31/2020,,,https://www.tiktok.com/@yazzdazzz/video/6832895812771646725,39.73845291,-104.9848557,Less Lethal Round,"effects of being hit in the face with a ""less lethal"" round. CW: severe gore. [TikTok @ https://tiktok.com/@yazzdazzz/video/6832895812771646725]",31/05/2020,2,11,44.4,44.4,420.2529498802825,283.22874397072854,159.03193683420633,145.66729138682473,0.0,0.0
88,88,88,"Denver, CO, USA",05/31/2020,,,https://www.tiktok.com/@yazzdazzz/video/6832899302566661382,39.739032,-104.98657299999999,Pepper Spray,"police rip a sign out of the hands of a peaceful protestor, then pepper-spray them in the face for sport. [TikTok @ https://tiktok.com/@yazzdazzz/video/6832899302566661382]",31/05/2020,2,11,44.4,44.4,403.2148527102605,300.09509089813815,44.40009754714361,496.0412825003993,0.0,0.0
89,89,89,"Los Angeles, CA, USA",05/31/2020,,05/30/2020,https://www.tiktok.com/@w17ard/video/6833082563913977093,34.076143,-118.357381,Less Lethal Round,"Individuals knee on ground, arms raised, infront of a row of police officers (county sherffs). Something disturbs the officers. The source claims a water bottle was thrown at the officers. Then one officer throws a stun grenade at the crowd of individuals who start to run away. Police officers start shooting fleeing individuals with rubber bullets.  ",31/05/2020,2,15,44.4,44.4,198.2065122775416,397.1080390653226,59.740491662864066,253.13343275945095,0.0,0.0
90,90,90,"Los Angeles, CA, USA",06/01/2020,00:06:00,,https://twitter.com/jkishore/status/1267216022634999808,34.05223846,-118.2433472,Physical Assault,Police officers physically assault a group of unarmed individuals in a huddle in a road. ,01/06/2020,3,15,44.4,44.4,167.70286664334222,433.7641212059046,347.9890561230806,167.02212844832164,0.0,0.0
91,91,91,"Los Angeles, CA, USA",06/01/2020,00:12:00,,https://twitter.com/MattMcGorry/status/1267217360894562306,34.071897,-118.363212,Physical Assault,Police officers physically assault civilians and shoot them at close range.,01/06/2020,3,15,44.4,44.4,113.65519068129518,433.51854360148553,330.86844611217583,155.3322455615811,0.0,0.0
92,92,92,"Las Vegas, NV, USA",06/01/2020,00:29:00,,https://www.instagram.com/p/CA14rooHIC6/,36.167651,-115.136771,Arrest/Detention,"Police in riot gear appear to have arrested multiples civilians, violently dragging one of them to the police vehicle, while another one states that the civilian didn't do anything other than say ""no justice no peace"". A police officer points to the civilian filming telling him ""you're next"".",01/06/2020,3,6,44.4,44.4,237.08572595503682,357.8581755434451,928.0875299398666,243.09365952937125,0.0,0.0
93,93,93,"Cincinnati, OH, USA",06/01/2020,01:03:00,,https://twitter.com/P0kes/status/1267230163521191936,39.10689,-84.509313,Intimidation,"Police give notice that citizens are living in occupied territory, taking down the American flag outside the Justice Center and replacing it with their own.",01/06/2020,3,36,44.4,44.4,759.713169559877,302.74348736979954,456.0028991237587,487.18176279351275,0.0,0.0
94,94,94,"San Jose, CA, USA",06/01/2020,01:08:00,,https://twitter.com/venomwithinher/status/1267231621347864578,37.338101,-121.885981,Tear Gas,police shooting rounds at close range into unarmed peaceful protestors outside City Hall. [@venomwithinher],01/06/2020,3,17,44.4,44.4,85.62891093789663,361.18651464171813,685.1267173112218,162.04955923360595,0.0,0.0
95,95,95,"Minneapolis, MN, USA",06/01/2020,01:24:00,,https://twitter.com/keycodez/status/1267235529311113216?s=20,44.975358,-93.248152,Pepper Spray,Multiple police SUVs responding to a medical emergency pepper spray a crowd on either side of the road from inside their vehicles.,01/06/2020,3,1,44.4,44.4,625.3272733588918,144.8795184388926,118.340464596752,461.4300326357111,0.0,0.0
96,96,96,"Murfreesboro, TN, USA",06/01/2020,02:09:00,,https://twitter.com/joe_spears7/status/1267246919673434113,35.843725,-86.372176,Tear Gas,Police vehicles are seen moving and tear gas is being deployed without any obvious reason other than being yelled at by the protesters. ,01/06/2020,3,37,44.4,44.4,731.5733195434084,375.252164434449,749.6360845404369,261.1602854472254,0.0,0.0
97,97,97,"Fredericksburg, TX, USA",06/01/2020,03:07:00,,https://twitter.com/Dannyklein69/status/1267261377435099142,38.314079,-77.474907,Tear Gas,Police escalate and fire tear gas into a peaceful protest.,01/06/2020,3,38,44.4,44.4,866.2000048836411,334.12954787597624,686.0210362260503,217.5816127161867,0.0,0.0
98,98,98,"Cincinatti, OH, USA",06/01/2020,04:02:00,06/01/2020,https://twitter.com/thepoeticgopher/status/1267456370292461568,39.106199600000004,-84.5087241,Other,"Civilians arrested overnight are detained in a courtyard outside the Justice Center for more than 10 hours with no food, water, or toilet facilities.",01/06/2020,3,39,44.4,44.4,764.9734347933716,344.54715397637386,1050.1688324533807,468.4694392423694,0.0,0.0
99,99,99,"Fort Wayne, IN, USA",06/01/2020,04:18:00,05/29/2020,https://twitter.com/SheriffErinFogg/status/1267279365752184835,41.079475,-85.13830899999998,Pepper Spray,"Individual having a conversation with police officer in a car, asking why they are being gassed. Pepper spray goes off behind them.",01/06/2020,3,8,44.4,44.4,718.1522824967917,271.9164428405647,136.37216912997349,534.4619914062536,0.0,0.0
100,100,100,"Grand Rapids, MI, USA",06/01/2020,04:26:00,05/30/2020,https://twitter.com/greg_doucette/status/1267281344649932806,42.963242,-85.666978,Pepper Spray,"A civilian yells at police from a distance, a police officer walks up and pepper sprays them then another officer shoots them directly in the face with a teargas canister.",01/06/2020,3,40,44.4,44.4,733.1140954646337,192.60712292669257,96.61468556794426,532.2457221031049,0.0,0.0
101,101,101,"Tulsa, OK, USA",06/01/2020,05:01:00,,https://twitter.com/KTULNews/status/1267388909937405952,36.111582,-95.975616,Less Lethal Round,Police officers fire pepper balls and tear gas at protestors and a reporter live on air.,01/06/2020,3,41,44.4,44.4,557.3437676865713,368.196399548679,93.43815853787837,236.49768286828186,0.0,0.0
102,102,102,"Fort Wayne, IN, USA",06/01/2020,05:09:00,05/30/2020,https://wpta21.com/2020/05/31/toddler-tear-gassed-photo-goes-viral/,41.078624,-85.137499,Tear Gas,"Individual and their 3-year-old child tear-gassed out of their car and caught in the crossfire. After street-medic had treated the child, an officer threw another gas cannister at her feet where it exploded.",01/06/2020,3,8,44.4,44.4,739.5438941510404,267.74477486929874,726.9403768181371,263.8974302764616,0.0,0.0
103,103,103,"Tampa, FL, USA",06/01/2020,05:14:00,,https://twitter.com/flawlessfatigue/status/1267293467362889729,27.956432,-82.455937,Less Lethal Round,Police officers fire less lethal rounds at a group of people shouting at them from a distance.,01/06/2020,3,42,44.4,44.4,793.2757486507525,542.5462112079485,181.64758887366662,232.05147302644448,0.0,0.0
104,104,104,"Columbus, OH, USA",06/01/2020,05:16:00,,https://twitter.com/Youngdaggerdrip/status/1267293923317288961,39.9623001,-82.99968940000002,Other,Police officers destroy public property for no aparrent reason.,01/06/2020,3,0,44.4,44.4,797.5676635267977,303.9169930476051,983.9522472435606,563.3859469968403,0.0,0.0
105,105,105,"Raleigh, NC, USA",06/01/2020,05:21:00,,https://twitter.com/noshoulding/status/1267279536686804993?s=20,35.78064000000001,-78.64007099999998,Physical Assault,"Police in riot gear after having deployed multiple tear gas canisters, are seen moving aggressively towards retreating civilians, pointing a riot control gun and then immediately grabbing/physically attacking one of them.",01/06/2020,3,19,44.4,44.4,847.6072319868705,371.995423988888,439.95436851892845,146.21637092239058,0.0,0.0
106,106,106,"Athens, GA, USA",06/01/2020,06:16:00,,https://twitter.com/HunterRiggall/status/1267308893438455809,33.9576658,-83.3751742,Tear Gas,Police officers use tear gas to disperse protestors near the University of Georgia campus.,01/06/2020,3,43,44.4,44.4,790.8076248071617,407.78142525706386,696.6121453314476,235.92315041248557,0.0,0.0
107,107,107,"Athens, GA, USA",06/01/2020,06:35:00,,https://twitter.com/tmckenzie_photo/status/1267313794956562432,33.957429499999996,-83.3761647,Tear Gas,Police officers fire teargas and bullets near the University of Georgia campus.,01/06/2020,3,43,44.4,44.4,796.3908897942331,429.3154369262471,763.1859824101614,216.1793377856761,0.0,0.0
108,108,108,"Hoover, AL, USA",06/01/2020,06:54:00,,https://twitter.com/mtvtacallya/status/1267318555604910081,33.388737,-86.80599699999998,Pepper Spray,"police force everyone onto a hill, then beat the sh*t out of everyone who can't make it up there fast enough. Several, including the woman in the yellow dress, were pepper-sprayed after being handcuffed",01/06/2020,3,44,44.4,44.4,717.8324154607577,423.0567012398652,136.23131249191027,492.8251416948304,0.0,0.0
109,109,109,"Raleigh, NC, USA",06/01/2020,07:23:00,06/01/2020,https://twitter.com/bennykoval/status/1267325857892368384?ref_src=twsrc%5Etfw%7Ctwcamp%5Etweetembed%7Ctwterm%5E1267325857892368384%7Ctwgr%5E&ref_url=https%3A%2F%2Fwww.advocate.com%2Fcrime%2F2020%2F6%2F04%2Fqueer-bar-owner-shot-police-after-giving-first-aid-protesters,35.77518900000001,-78.640132,Less Lethal Round,Police officers fire flash-bangs at a business owner (reported to be giving first aid to protesters in the business owner's parking lot).,01/06/2020,3,19,44.4,44.4,843.4272521736965,414.45304505072147,195.14124335225847,193.25026993376204,0.0,0.0
110,110,110,"Huntington Beach, CA, USA",06/01/2020,07:58:00,,https://twitter.com/Ricardo_4715/status/1267334754119999488,33.6586785,-118.0040172,Less Lethal Round,Police open fire on unarmed civilians laying flat on the ground.,01/06/2020,3,45,44.4,44.4,170.89569445092354,454.629164982328,21.774595271987568,176.94959924718466,0.0,0.0
111,111,111,"Sacramento, CA, USA",06/01/2020,10:48:00,06/01/2020,https://twitter.com/reereeisme65/status/1267377454059937792,38.578556,-121.48664099999999,Physical Assault,"Police officers choke a civilian, and intimidate/push away other civilians trying to stop them.",01/06/2020,3,27,44.4,44.4,128.5729053086363,308.0623922573485,373.86307926688056,206.01613130831274,0.0,0.0
112,112,112,"San Diego, CA, USA",06/01/2020,12:43:00,,https://twitter.com/mariahalize3/status/1267225330093191168,32.71586,-117.16295600000001,Tear Gas,Peaceful protest interrupted by tear gas and bullets,01/06/2020,3,33,44.4,44.4,208.1214656505204,474.37643713433243,632.6382774874218,167.79341762219576,0.0,0.0
113,113,113,"Louisville, KY, USA",06/01/2020,15:52:00,,https://twitter.com/Itz5500Gillz/status/1267454024288292867,38.245696,-85.75254699999998,Less Lethal Round,Police officers shoot less lethal rounds from overpass at cars.,01/06/2020,3,28,44.4,44.4,739.718126708577,331.99792793123527,101.10065957624053,148.24447894882064,0.0,0.0
114,114,114,"Little Rock, AR, USA",06/01/2020,17:05:00,05/31/2020,https://m.facebook.com/jennifer.d.lewis.16/posts/10217853508634716,34.744561,-92.28800600000001,Less Lethal Round,Individuals standing still with their hands raised are shot with less lethal rounds (flashbangs) by police officers.,01/06/2020,3,46,44.4,44.4,621.6904020769508,408.91553311772867,138.849471031677,123.63720119832149,0.0,0.0
115,115,115,"Los Angeles, CA, USA",06/01/2020,19:13:00,,https://twitter.com/liveinochi/status/1267504585926557696,34.05223846,-118.2433472,Less Lethal Round,Police officers shoot less lethal rounds at two civilians having a conversation halfway down the block.,01/06/2020,3,15,44.4,44.4,219.68116297692035,417.6296755835929,104.88394355662444,269.1540551339309,0.0,0.0
116,116,116,"Joliet, IL, USA",06/01/2020,19:44:00,,https://twitter.com/greg_doucette/status/1267861168384880650,41.522883,-88.121123,Arrest/Detention,"Civilians leaving a protest arrested by police officers, one arrest is carried out violently.",01/06/2020,3,47,44.4,44.4,674.2382068483751,264.77718874101447,1009.0079497742486,230.8045008007373,0.0,0.0
117,117,117,"Seattle, WA, USA",06/01/2020,21:12:00,,https://twitter.com/spekulation/status/1267172073232674816?s=20,47.6119,-122.33656299999998,Pepper Spray,"Police officers form a line to force protestors into a tight group against a wall, so they can then repeatedly pepper-spray them without anyone being able to leave.",01/06/2020,3,20,44.4,44.4,89.50867458500409,85.63446802472377,52.675328087945395,527.759600715745,0.0,0.0
118,118,118,"Denver, CO, USA",06/01/2020,21:14:00,,https://youtu.be/xNLZ7exVxq4,39.739579,-104.98616399999999,Less Lethal Round,Reporter shot by a less lethal round.,01/06/2020,3,11,44.4,44.4,398.7276735646356,278.59705346198064,123.71540867897643,159.63356118340857,0.0,0.0
119,119,119,"Little Rock, AR, USA",06/01/2020,22:31:00,05/31/2020,https://twitter.com/KATVShelby/status/1267554421019475972,34.746381,-92.28792,Less Lethal Round,Civilians kneeling on the ground are shot at with less lethal rounds. Also extensive use of tear gas.,01/06/2020,3,46,44.4,44.4,622.1511525001362,386.9227272229874,137.14868411385146,180.56611257841612,0.0,0.0
120,120,120,"Indianapolis, IN, USA",06/01/2020,23:04:00,,https://twitter.com/bubbaprog/status/1267562799804428288,39.768017,-86.15805300000002,Tear Gas,Police officers use teargas on a crowd gathered and worshipping in the streets.,01/06/2020,3,48,44.4,44.4,708.1497983168327,291.45622631697717,767.4061482274599,170.95243743917925,0.0,0.0
121,121,121,"Beavercreek, OH, USA",06/01/2020,23:11:00,,https://twitter.com/b0ywxnder/status/1267564356667150336,39.7699303,-84.052098,Tear Gas,Police fire teargas into a group of civilians.,01/06/2020,3,49,44.4,44.4,750.5838204717563,285.2427957139184,732.8695438803835,187.92471696185768,0.0,0.0
122,122,122,"Des Moines, IA, USA",06/01/2020,23:31:00,,https://twitter.com/SharaneCalister/status/1267478856572850178,41.630284,-93.697868,Tear Gas,"Woman is drives in her car with her mother when car in front shouted ""black lives don't matter"". Police responded by shooting teargas into the victims car window, damaging her mothers hand and smashing her phone. ",01/06/2020,3,50,44.4,44.4,591.0262519708996,230.41595229980922,722.6745109193391,148.1799065244544,0.0,0.0
123,123,123,"Austin, TX, USA",06/01/2020,23:57:00,05/31/2020,https://twitter.com/DavidFr31601156/status/1267576000105320449,30.26755510000001,-97.7344297,Less Lethal Round,"Officers fire ""less-lethal"" beanbag munition at a group of individuals, including clearly-marked medical volunteers. The group was carrying, Justin Howell, a 20 year-old who had been hit in the head by a ""less-lethal round"". The officers had directed the individuals to carry Howell to the police headquarters when they fired at them. ",01/06/2020,3,31,44.4,44.4,534.0118078810584,522.6456361623544,82.64656569901406,136.18368373617685,0.0,0.0
124,124,124,"Atlanta, GA, USA",06/01/2020,,,https://twitter.com/greg_doucette/status/1269088901135810561,41.86449810000001,-87.6554936,Physical Assault,"Protestor intervened in police assault on another Black protestor, and in an officer tackled the protestor to the ground and beat them repeatedly. Officer commanded protestor to “stop resisting” even though protestor had already surrendered. Officer slammed protestor’s head into the ground causing a concussion and damaged their right calf’s ligaments. Protestor was detained for 18 hours before being released.",01/06/2020,3,2,44.4,44.4,696.6840934042393,270.71186812395604,354.59490351626084,208.60570077482893,0.0,0.0
