254,254,254,"Orlando, FL, USA",06/08/2020,03:30:00,06/01/2020,https://twitter.com/Concerned407/status/1269825310494785536?s=20,28.5384842,-81.3850019,Pepper Spray,A police officer pepper sprays an individual in the face and then sprays another who turns and runs away while a group of officers move to arrest someone else.,08/06/2020,10,22,44.4,44.4,815.2357804450353,543.7046318053884,76.58638533927332,559.3717678941721,0.0,0.0
255,255,255,"San Jose, CA, USA",06/08/2020,04:58:00,,https://twitter.com/ex_Tesla/status/1268341102211297280,37.338101,-121.885981,Intimidation,SJPD shoots a protestor while he's on the ground,08/06/2020,10,17,44.4,44.4,98.62548698737746,342.44586093766384,377.1672387916408,460.111616937513,0.0,0.0
256,256,256,"Seattle, WA, USA",06/08/2020,05:21:00,,https://twitter.com/menilivne/status/1269831790799159302,47.615286,-122.315683,Physical Assault,Police officers physically assault and use pepper spray on protestors. ,08/06/2020,10,20,44.4,44.4,149.87265396586088,88.97574653094485,361.5716409763868,189.46073409292515,0.0,0.0
257,257,257,"Asheville, NC, USA",06/08/2020,07:03:00,05/31/2020,https://twitter.com/ILTTS/status/1269857547843973121,35.590385,-82.57429,Less Lethal Round,Officers shoot a civilian in the face with a pepperball. Potential use of tear gas too.,08/06/2020,10,62,44.4,44.4,782.7421516230538,383.71120788118293,145.1811387923385,218.44524538824285,0.0,0.0
258,258,258,"Portland, OR, USA",06/08/2020,08:43:00,,https://www.pscp.tv/w/cayD6DFvUEtMeEFQa01nS2R8MUJSSmpZekVEa2pHd0WiB5ZBpP-lbOT_44aFHFHjNFkx-HYTXsO-WLw5CzmT,45.51541623,-122.679273,Arrest/Detention,"A police officer says ""Press passes don't matter"" to an individual who replies, ""Sir, can I see your name please?"" The officer responds, ""You can see my number."" When asked for their name again, the officer asks, ""Do you want to go to jail?"" and then declares the person is under arrest.",08/06/2020,10,68,44.4,44.4,129.4137776017714,169.9192104471519,964.8357341458302,165.9705489410667,75.37039117442987,71.45359407454843
259,259,259,"Seattle, WA, USA",06/08/2020,09:12:00,,https://twitter.com/chaseburnsy/status/1269889977363525634,47.615312,-122.318165,Tear Gas,Police officers use tear gas and flash bangs against protestors.,08/06/2020,10,20,44.4,44.4,92.25078729499499,57.490157097528105,655.186143315218,234.38420778603304,0.0,0.0
260,260,260,"Seattle, WA, USA",06/08/2020,10:11:00,,https://twitter.com/RisingAnons/status/1269904786108887045,47.615241999999995,-122.318743,Less Lethal Round,"Protestor hit with less lethal round from down the street whilst part of peaceful, chanting crowd.",08/06/2020,10,20,44.4,44.4,60.572213217864835,85.56727851331956,81.34881530826742,258.3772152388492,0.0,0.0
261,261,261,"New York City, NY, USA",06/08/2020,17:50:00,,https://twitter.com/greg_doucette/status/1270020411443613696,40.723163,-73.999076,Physical Assault,"Police officers pull individual out of their car and assault them [reported, video not clear]",08/06/2020,10,3,44.4,44.4,940.6112963556318,209.53052418245326,415.7919682284354,251.7038423077681,0.0,0.0
262,262,262,"Charlotte, NC, USA",06/08/2020,23:58:00,06/08/2020,https://twitter.com/kaitlinwa24/status/1270113046606864389,35.220268,-80.83753399999998,Physical Assault,Police officers tackle a civilian to the ground and arrest them with no provocation.,08/06/2020,10,65,44.4,44.4,803.7226632981049,390.2841949067896,438.32098145909424,166.76431895405207,0.0,0.0
263,263,263,"Pittsburgh, PA, USA",06/09/2020,21:31:00,06/01/2020,https://twitter.com/RyanDeto/status/1270438306929610752,40.462982000000004,-79.926271,Arrest/Detention,Multiple officers arrest an individual with no provocation and pin them to the ground next to several others who have been detained. An office rolls a tear gas cannister at onlookers.,09/06/2020,11,53,44.4,44.4,834.7428440722686,258.7485064541232,1063.3188701853776,200.41418423331837,0.0,0.0
264,264,264,"Fort Lauderdale, FL, USA",06/09/2020,21:40:00,05/31/2020,https://twitter.com/MrEvanRoss/status/1270440535518560256,26.120699,-80.1423958,Less Lethal Round,"Police shoot civilian, LaToya Ratlieff, in the head with a rubber bullet.",09/06/2020,11,84,44.4,44.4,836.4619613675648,566.3961063263483,165.52939449925714,219.20079553873924,0.0,0.0
265,265,265,"East Meadow, NY, USA",06/13/2020,05:02:00,06/12/2020,https://twitter.com/MarisaKabas/status/1271930315544633345,40.725984000000004,-73.556722,Arrest/Detention,"A police officer stops walking abruptly so as to cause a civilian to bump into them. Afterwards two officers pull the civilian down to the floor whilst another officer kicks them. Two officers then restrain the civilian on the floor. Despite the civilian not resisting, a third officer assists in holding them down,

Another angle shows the civilian being restrained on the floor by three officers,

Upon verbally confronting officers about their restraint of the previous civilian, another civilian is grabbed by two officers and pushed down to the ground and restrained. ",13/06/2020,12,85,44.4,44.4,969.7695552878587,268.32073711313,1011.6516140543774,189.63753940410186,0.0,0.0
266,266,266,"Atlanta, GA, USA",06/13/2020,11:31:00,06/12/2020,https://twitter.com/EricWasserman1/status/1271736825195794432,33.721732,-84.392085,Killing,"Two officers are attempting to detain an unarmed civilian on the floor. There is a struggle and the civilian manages to get up and run away. As the civilian runs away the officers chase after them, firing their tazers at the civilain. The tazer does not seem to hit the civilian, but afterwards an officer fires three live rounds which hit and kill the civilian,

The civilian filming states that they witnessed the murder of an unarmed non-violent civilian by three officers in a Wendy drivethrough. The civilian filming states that the officers had been speaking with the murdered civilian for 20 minutes previously and had shot them for no apparent reason. The video cuts to show the murdered civilian on a stretcher being moved into an ambulance,

Two officers stand over the civilian that they shot, not administering first aid. At the end of the video the civilain lifts their left arm in the air, showing that at this point they were still alive,

The civilian is running away from two officers. Whilst running, the civilain turns to point a yellow object - seemingly one of the officer's tazers - at one of the officers. The officer then proceeds to shoot the civilain with live rounds,",13/06/2020,12,2,44.4,44.4,762.2932714529738,440.8420044013636,700.8949915092273,498.12557758915506,0.0,0.0
267,267,267,"Beverly Hills, CA, USA",06/13/2020,11:51:00,06/12/2020,https://twitter.com/J7_TreeOfLibrty/status/1271741959099432960,34.08029556,-118.4046783,Tear Gas,Officers repeatedly fire tear gas at civilians who are retreating and not acting violently. ,13/06/2020,12,86,44.4,44.4,124.90490491934163,390.334220676132,661.158347610355,137.32497170746248,0.0,0.0
268,268,268,"Austin, TX, USA",06/14/2020,06:31:00,05/31/2020,https://twitter.com/greg_doucette/status/1272386250058727425,30.26802600000001,-97.734158,Less Lethal Round,Individual being treated by street medics with remnants of a beanbag round lodged in their face.,14/06/2020,13,31,44.4,44.4,527.1810660073318,468.4792991630378,156.5155830748712,181.76869904651417,0.0,0.0
269,269,269,"Portland, OR, USA",06/14/2020,09:09:00,06/14/2020,https://twitter.com/tuckwoodstock/status/1272063558403014657,45.516465999999994,-122.680352,Physical Assault,"A civilian falls to the ground, another tries to help them up and is physically assaulted by police officers. Tear gas in strong evidence and police loudspeaker declaring unlawful assembly. ",14/06/2020,13,68,44.4,44.4,69.36346611614547,181.35601981606473,324.86133144241666,175.398228642341,920.0431808015851,179.5117919570388
270,270,270,"Fort Wayne, IN, USA",06/14/2020,17:36:00,05/30/2020,https://www.facebook.com/sonny.murray.79/videos/927655467695750/?d=n,41.079809999999995,-85.138359,Pepper Spray,"Police pepper spray civilians and arrest one, kneeling on their neck.",14/06/2020,13,8,44.4,44.4,729.1359423739783,250.06113704405726,100.61918638104619,471.2117893147142,0.0,0.0
271,271,271,"Philadelphia, PA, USA",06/14/2020,19:03:00,06/13/2020,https://twitter.com/UR_Ninja/status/1271968811886022656,39.915576,-75.171776,Intimidation,"An officer tells a journalist that they are giving them three warnings to disperse, cliaiming that the journalist is aggravating the situation and inciting a riot, despite them only filming, not engaging in any violent behaviour and actually being the victim of an attack by a member of the crowd they are documenting prior to this video. The journalist asks for the officer's name and badge number and tells the officer that they are there to fulfil their journalistic obligations to document the event, but that they will comply with their order,

Prior to the officer ordering the journalist to disperse, the crowd the journalist are documenting are seen cheering as a civilian waves a ""Trump 2020"" flag. The video also shows officers shaking hands with civilians part of this crowd,

Prior to the officer ordering the journalist to disperse, the crowd the journalist are documenting are seen cheering as a civilian waves a ""Trump 2020"" flag. The video also shows officers shaking hands with civilians part of this crowd.",14/06/2020,13,23,44.4,44.4,947.3907350677672,356.72157609309227,459.79797168461147,507.8304774163842,0.0,0.0
272,272,272,"Portland, OR, USA",06/15/2020,00:53:00,,https://twitter.com/greg_doucette/status/1272301072774823936,45.516678999999996,-122.677567,Intimidation,"Police officers clearing a park, shouting at individuals to ""get on a bike"" and with jail time. Video cuts out abruptly, commentary suggests the individual taking it was arrested. ",15/06/2020,14,68,44.4,44.4,90.86453697048357,153.70661915153485,393.13265026109565,446.499621111049,75.37713424727536,287.54536640430746
273,273,273,"Bethel, OH, USA",06/15/2020,04:34:00,06/14/2020,https://twitter.com/whiskeyrodent/status/1272356898722000896,38.963473,-84.08065500000002,Other,BLM Protestor physically assaulted by far-right protestor. Police officer visibly does nothing to help as BLM protestors are forced to move.,15/06/2020,14,87,44.4,44.4,781.1990982375341,329.44001389930446,1016.2381944237961,463.8489011623248,0.0,0.0
274,274,274,"Philadelphia, PA, USA",06/15/2020,05:36:00,06/14/2020,https://twitter.com/UR_Ninja/status/1272372388190191617,39.916887,-75.171472,Other,Individuals (far-right?) push (reporter-identified) BLM protestor into the road whilst police officers watch on and do nothing.,15/06/2020,14,23,44.4,44.4,926.5709930245001,282.6507761982399,1012.0808698867619,484.3980307484268,0.0,0.0
275,275,275,"New York City, NY, USA",06/15/2020,05:39:00,06/14/2020,https://twitter.com/carolineha_/status/1272389410202542081?s=20 ,40.650690999999995,-73.961129,Intimidation,"Over a dozen police officers wearing riot gear, at least four police cars, and a helicopter respond to fireworks in the Flatbush. Some of these officers entered buildings on Ocean Avenue and it is reported that at least one arrest was made during the night. While entering one of the buildings on Ocean Avenue a police officer pointed their flashlight directly at an individual videotapping and obscured their visibility in the process. Another officer then approached the individual pointing what looks to be a taser at them while telling them to back up despite verbally acknowledging the individual's press badge.",15/06/2020,14,3,44.4,44.4,964.3826500563,248.39506644708263,439.8643309839147,501.2920005727635,0.0,0.0
276,276,276,"Richmond, VA, USA",06/15/2020,07:52:00,06/14/2020,https://twitter.com/GoadGatsby/status/1272406679846617088,37.545968,-77.444855,Arrest/Detention,"Individual arrested and police officers use pepper spray on a shouting crowd, 
Liberal use of pepper spray on a crowd, 
Police officers push shouting but nonviolent crowd back using pepper spray.",15/06/2020,14,34,44.4,44.4,937.1782546914847,375.9714456523716,991.6454550937921,220.1402328786111,0.0,0.0
277,277,277,"Austin, TX, USA",06/15/2020,12:16:00,06/12/2020,https://www.newsweek.com/video-shows-police-kneeled-teenager-neck-1510829?amp=1&__twitter_impression=true,30.267731,-97.73410799999999,Physical Assault,"Police officers arrest two individuals, kneeling on one's neck. The second is violently thrown to the ground.",15/06/2020,14,31,44.4,44.4,534.2078780729165,489.312418175572,450.1362515591943,183.97164709353663,0.0,0.0
278,278,278,"Fort Wayne, IN, USA",06/15/2020,19:18:00,06/14/2020,https://twitter.com/stoneyydope_24/status/1272579204773818369,41.079538,-85.138061,Intimidation,"Police officers draw up in vehicles and order protestors / individuals to leave the area in the middle of the day when there is no curfew in place, citing unlawful assembly. They move down the streets towards civilians all holding guns.",15/06/2020,14,8,44.4,44.4,751.0250707382559,248.4735050096973,424.22178698385187,515.438144209364,0.0,0.0
279,279,279,"Louisville, KY, USA",06/16/2020,02:51:00,06/15/2020,https://twitter.com/kenjiboijoi/status/1272708377349668864,38.25421400000001,-85.760548,Less Lethal Round,Group of police officers physically assault an individual. Pepperball is shot at the window where the video is being taken from.,16/06/2020,15,28,44.4,44.4,708.0590251750848,330.94588503362894,124.73760042778909,217.1734250999905,0.0,0.0
280,280,280,"Richmond, VA, USA",06/16/2020,03:47:00,06/15/2020,https://twitter.com/GoadGatsby/status/1272707396197064706?s=20 https://twitter.com/GoadGatsby/status/1272711269775224841?s=20 https://twitter.com/GoadGatsby/status/1272712020203319296?s=20 https://twitter.com/GoadGatsby/status/1272701413169287175?s=20 https://twitter.com/GoadGatsby/status/1272702871088365569?s=20,37.5464,-77.445546,Less Lethal Round,Police officers are staged inside a dark parking garage outside of Richmond Police Headquarters. According to reports they seem to be intentionally targeting people with laser pointers and phones in the crowd below. They are shooting rubber bullets. At least one person was hit and one phone was destroyed.,16/06/2020,15,34,44.4,44.4,913.5298425841879,342.0418823890382,138.11433142293777,144.5696952146907,0.0,0.0
281,281,281,"Richmond, VA, USA",06/16/2020,04:20:00,06/15/2020,https://twitter.com/aeringle/status/1272715627153817601,37.545802,-77.444889,Tear Gas,Police officers deploy tear gas against individuals.,16/06/2020,15,34,44.4,44.4,902.4686942102279,395.41447612789995,719.1584595976358,234.50600510511785,0.0,0.0
282,282,282,"Richmond, VA, USA",06/16/2020,04:22:00,06/15/2020,https://twitter.com/GoadGatsby/status/1272716271059173381?s=20 https://twitter.com/GoadGatsby/status/1272718095476494336?s=20,37.545897,-77.44493,Pepper Spray,,16/06/2020,15,34,44.4,44.4,883.1836069262341,359.068993055179,139.18586565123823,451.3693088496559,0.0,0.0
283,283,283,"Richmond, VA, USA",06/16/2020,05:36:00,06/16/2020,https://twitter.com/GoadGatsby/status/1272734650763563014?s=20,37.546282,-77.445471,Other,The group of individuals are moving back toward the police headquarters where they are met by a line of police officers standing across N Madison Street. It is reported at this time that the police officers have declared this an unlawful assembly.,16/06/2020,15,34,44.4,44.4,892.520889741367,376.8345172328651,975.2392696931731,480.1217283243446,0.0,0.0
284,284,284,"Fort Wayne, IN, USA",06/16/2020,06:23:00,06/14/2020,https://twitter.com/greg_doucette/status/1272746478956695553,41.079716,-85.137263,Less Lethal Round,"Police officers order an individual to leave a local business and then chase them down the street, firing less lethal rounds. Middle of the day, no curfew declared in Fort Wayne.",16/06/2020,15,8,44.4,44.4,772.5426230624081,244.0052288227859,99.3909493623575,185.36896711942222,0.0,0.0
285,285,285,"Portland, OR, USA",06/16/2020,08:23:00,06/15/2020,https://twitter.com/tuckwoodstock/status/1272776683674689536,45.517395,-122.680921,Less Lethal Round,"Individual being treated by street medics for a pepperball to the head outside of the dispersal zone (incident self-reported, not a video).",16/06/2020,15,68,44.4,44.4,29.805116933692815,154.89500992502522,41.83419371466724,215.94223708736246,233.75863387147527,283.60118375997547
286,286,286,"Portland, OR, USA",06/16/2020,09:12:00,06/16/2020,https://twitter.com/MrOlmos/status/1272804270698401794,45.517665,-122.676229,Intimidation,"Police officers threaten to arrest a reporter and use intimidating language. Easily hear police officers delcaring an unlawful assembly in the background.
Police officer threatening arrest - same incident, different video.",16/06/2020,15,68,44.4,44.4,131.91365783732152,120.4412645109986,368.8351675551405,536.1459453450871,211.6303199722708,271.83183738120425
287,287,287,"Portland, OR, USA",06/16/2020,09:17:00,06/16/2020,https://twitter.com/tuckwoodstock/status/1272790485375959041,45.516309,-122.678832,Intimidation,Police officers chase two unarmed individuals (and more?) out of the park.,16/06/2020,15,68,44.4,44.4,53.20387922683042,106.82931117450123,416.36961580891455,474.6584855565915,230.60249094323825,262.8421092007783
288,288,288,"Portland, OR, USA",06/16/2020,10:16:00,06/16/2020,https://twitter.com/AlexMilanTracy/status/1272805156225048578,45.518811,-122.675349,Arrest/Detention,Police officer threatens journalist with arrest and blocks journalist from filming other arrests.,16/06/2020,15,68,44.4,44.4,91.00010700842411,132.11050983972004,991.5560837065241,240.97708776780516,214.78146267119266,292.5882530555989
289,289,289,"Richmond, VA, USA",06/16/2020,16:06:00,06/15/2020,https://twitter.com/myVPM/status/1272893392440229899,37.546088,-77.445064,Tear Gas,"Police officers fire tear gas repeatedly into a crowd of civilians with their hands up. Invididual is shot in groin/stomach area, unsure with what.",16/06/2020,15,34,44.4,44.4,915.2754647521267,377.25622887958815,745.612967949247,226.5135675644264,0.0,0.0
290,290,290,"Portland, OR, USA",06/17/2020,04:52:00,06/13/2020,https://twitter.com/KyleIboshi/status/1273085973316775936?s=20,45.51601791,-122.681427,Other,Plane flying over Portland on the evening of 6/13/2020 was equipped with advanced surveillance equipment and operated by a shell company linked to federal agents according to FAA records.,17/06/2020,16,68,44.4,44.4,71.34040757177871,140.9913874293594,949.6891279087804,508.13324676528646,379.85107223050306,287.52185273281987
291,291,291,"Portland, OR, USA",06/18/2020,04:26:00,,https://twitter.com/greg_doucette/status/1273442002219208705,45.518671999999995,-122.676507,Less Lethal Round,"Police officers repeatedly shoot at an individual with less lethal rounds while they are complying with orders and walking away from the officers.  The individual reports that they have been hit with a rubber bullet on their right leg and a concussion grenade on their left foot. As more shots are fired the individual begins to speed up their pace. At the begining the video the individual states that the officers are ""following us"". This suggests that there are other complying individuals being shot at even though they are not visible in the video.",18/06/2020,17,68,44.4,44.4,50.644070162493115,148.77052704248416,41.625530014362546,148.09579154595596,497.69797077054545,287.55128150337634
292,292,292,"Louisville, KY, USA",06/18/2020,19:52:28,06/15/2020,https://www.instagram.com/p/CBleLePnpR_/,38.250002,-85.76573,Physical Assault,"A line of police officers are shouting ""Move Back"" while advancing toward a group of people gathered on South 9th Street. Two officers break off from this line and push down an individual who is standing on the sidewalk. One officer shoves the individual again while they are on the ground. Other officers begin to congregate on the sidewalk and less-lethal rounds are shot at anyone who approaches the individual on the ground.",18/06/2020,17,28,44.4,44.4,723.6731889469578,346.3467949318368,412.75902344313056,117.48260416124903,0.0,0.0
293,293,293,"Charlotte, NC, USA",06/18/2020,20:34:00,6/18/2020,https://twitter.com/jefftaylorhuman/status/1273691995752615937?s=20 https://twitter.com/greg_doucette/status/1273815766262001664?s=20 https://twitter.com/jefftaylorhuman/status/1273685452541870080?s=20,35.220591999999996,-80.837346,Arrest/Detention,"A group of people have set up jail support tents in front of the Mecklenburg County Sheriff Office to provide food, drinks, rides home, and other services for individuals after they are bailed out of jail. Earlier in the day it is reported that the Sheriff requested that the group leave the premises by 2PM. Around this time several officers advanced on the group. The officers then began to use force to pin down individuals in the street and arrest them. In addition, among those individuals arrested were at least 3 public defenders who were entitled by law to be at the jail.",18/06/2020,17,65,44.4,44.4,825.3159256132167,393.27370619084934,1001.6330327969541,149.81515978474016,0.0,0.0
294,294,294,"Raleigh, NC, USA",06/19/2020,01:57:45,06/18/2020,www.facebook.com/1394730031/videos/10224282274429902/?extid=vESj9Z8rxRLMsjyU www.facebook.com/528070219/videos/10163910345810220/?extid=opEJ89Al5lTsG9fC,35.780497,-78.641609,Arrest/Detention,"Police officers drag an individual across the street, before lifting them up, claiming they assaulted a police officer. Other individuals approach to demand they be released because no assault took place. One of these people hugs the body of the individual being pulled away by the officers, but is pulled off. Another individual approaches to hold onto the body. These individuals are seperated and both are arrested. ",19/06/2020,18,19,44.4,44.4,847.2722715027231,392.8204610660529,985.5714431466653,163.19659435783075,0.0,0.0
295,295,295,"Washington D.C., USA",06/19/2020,07:45:00,,https://twitter.com/greg_doucette/status/1273854378852659200 https://twitter.com/greg_doucette/status/1273855537961226240,38.900216,-77.03235,Less Lethal Round,"A line of officers are advancing down H street. The people are walking ahead of them, but they knock down a few individuals in their path and fire what sound to be stun grenades at the group.",19/06/2020,18,52,44.4,44.4,900.9635964985658,323.9242949007896,174.1582372467585,193.08618231169157,0.0,0.0
296,296,296,"Portland, OR, USA",06/20/2020,08:38:00,06/20/2020,https://twitter.com/tuckwoodstock/status/1274245209287614465?s=20,45.516932000000004,-122.67613300000001,Less Lethal Round,"Individual, who was hit on the head by a rubber bullet poses for a picture to document the bleeding, wounded and bandaged head and the assumed bullet that was shot at individuals during this incident. ",20/06/2020,19,68,44.4,44.4,151.19270486042947,188.39749831935177,88.05715947045223,112.63417349450246,774.9298275098021,287.1509768031776
297,297,297,"Portland, OR, USA",06/20/2020,12:54:00,06/20/2020,https://twitter.com/RaindropWorkPDX/status/1274309745415819264?s=20,45.515507,-122.677223,Less Lethal Round,Live-Stream video documenting the sound of the shooting of rubber bullets by police officers at assembled individuals infront of the Multnomah County Justice Centre.,20/06/2020,19,68,44.4,44.4,51.31421174383285,212.2445989025952,57.64693069218468,181.13499901121332,778.2070849866907,266.40249620105527
298,298,298,"Portland, OR, USA",06/20/2020,13:40:00,,https://twitter.com/greg_doucette/status/1274321189385768962,45.51601791,-122.681427,Less Lethal Round,"Police officers disperse assembled individuals. Camera passes through dense clouds of teargas. Towards the end, one police officer throws a teargas canister at the feed of the individuals without recognisable cause. [@KohzKah]",20/06/2020,19,68,44.4,44.4,51.60507031803615,169.9248135060942,38.42852634445298,189.59953135346188,794.5341081989875,279.60697358525977
299,299,299,"New York City, NY, USA",06/20/2020,21:35:00,05/30/2020,https://www.reddit.com/r/2020PoliceBrutality/comments/gu2u28/more_documented_aggression_in_flatbush_brooklyn/,40.646710999999996,-73.955648,Pepper Spray,"A police officer starts to push individuals with hands before attacking various people with a pepper spray, while many police officers stand aside without supporting or stoping the behaviour of the police officer.  ",20/06/2020,19,3,44.4,44.4,958.7209331586997,321.5461169198443,114.06940847117721,564.1601135834951,0.0,0.0
300,300,300,"Portland, OR, USA",06/21/2020,10:00:00,06/20/2020,https://twitter.com/i/status/1274628824232112128,45.515671999999995,-122.67728999999999,Physical Assault,This video is very dark and the camera moves very quickly making it hard to follow what exactly is happening. It seems that police officers hold individuals in place or on the ground and start beating. But this is hard to identify precisely. Flash-bang granades explode. ,21/06/2020,20,68,44.4,44.4,97.84056389192067,219.53951770141458,334.0808229528523,206.5583062814378,920.0203339414207,287.5388885031793
301,301,301,"Los Angeles, CA, USA",06/21/2020,17:32:00,05/30/2020,https://www.reddit.com/r/PublicFreakout/comments/gturig/cop_has_his_knee_on_a_womans_neck_even_though/?utm_source=share&utm_medium=web2x,34.070217,-118.352721,Physical Assault,"An individual is being held on the ground by three police officers, while another, fourth, police officer is first attempting to and then succeeds in kneeing on the person's neck. This seems an unnecessary use of force by the police officer. Another police officer seems to notice the incident and pulls the fellow police officer off the person's neck. ",21/06/2020,20,15,44.4,44.4,153.6141376806452,418.498086922707,386.92087580895725,222.03053520990142,0.0,0.0
