125,125,125,"Cincinnatti, OH, USA",06/01/2020,,06/02/2020,https://www.youtube.com/watch?v=5w0vRT2zOdo&feature=youtu.be,39.119853000000006,-84.523394,Arrest/Detention,"Police vehicle announces that individuals are in violation of curfew. Police officers are approaching individuals on the streets from three different sides, asking individuals to go home, while seemingly trapping the assembled crowd. One police officer runs towards an individual, pushes them on the ground and arrests the person. Individuals leave scene at a small path passing through a wall seen from a far with the reporting camera. More protesters are being arrested by the police officers after being trapped on the street. Individual documenting the scene is being pushed away forcefully by the police officers while filming the arrest of another protester in close-up. ",01/06/2020,3,51,44.4,44.4,729.3692781899903,290.6423299032278,1045.0623961339452,165.2715901736473,0.0,0.0
126,126,126,"Washington D.C., USA",06/02/2020,00:41:00,06/01/2020,https://twitter.com/benyc/status/1267587033783992322,38.90020300000001,-77.036191,Physical Assault,"Police officers repeatedly assault a reporter and a cameraman as they film, and then move away.",02/06/2020,4,52,44.4,44.4,897.5559353341798,305.1994318463309,455.7164009495872,255.420076281069,0.0,0.0
127,127,127,"Pittsburgh, PA, USA",06/02/2020,01:00:00,,https://m.facebook.com/story.php?story_fbid=2935858916468885&id=100001344162878&sfnsn=mo&d=n&vh=i,40.457474,-79.933378,Less Lethal Round,"Police officers use tear-gas and less lethal rounds on civilians chanting 'hands up, don't shoot.'",02/06/2020,4,53,44.4,44.4,837.3430114496759,236.83272941734725,159.81504652718786,258.0559908263127,0.0,0.0
128,128,128,"Richmond, VA, USA",06/02/2020,01:38:00,,https://twitter.com/LVozzella/status/1267601506175418369,37.553971999999995,-77.45975,Tear Gas,Police use tear gas against peaceful civilians.,02/06/2020,4,34,44.4,44.4,868.3060109307569,372.9323002935037,667.4053898305092,253.6462916090577,0.0,0.0
129,129,129,"Richmond, VA, USA",06/02/2020,01:56:00,,https://twitter.com/myVPM/status/1267605983641075712,37.553971999999995,-77.45975,Tear Gas,Police deploying tear gas and closing in on an area by surrounding and forcing civilians out.,02/06/2020,4,34,44.4,44.4,820.7196637833864,340.86867868478396,771.7994557059058,197.2934963004926,0.0,0.0
130,130,130,"Washington D.C., USA",06/02/2020,02:13:00,,https://twitter.com/esthersalli/status/1267610370514042881,38.901351,-77.03704599999998,Intimidation,"Police block civilians in until after curfew, and arrest them. ",02/06/2020,4,52,44.4,44.4,852.2433328642506,272.9472621526298,441.7702303755129,460.5013820699656,0.0,0.0
131,131,131,"Atlanta, GA, USA",06/02/2020,02:32:00,,https://twitter.com/raiinntweets/status/1267615113953099778,33.75799,-84.393415,Intimidation,"Police and National Guard blocking exits from a protest, potentially with the aim of arresting everyone after curfew. ",02/06/2020,4,2,44.4,44.4,775.3074675692119,423.12015452437237,388.5434834385915,522.3381493505722,0.0,0.0
132,132,132,"Washington D.C., USA",06/02/2020,02:35:00,06/01/2020,https://twitter.com/WestofHereFox/status/1267615709791731713,38.90476608,-77.01628876,Physical Assault,"Protestor in gray shirt badly injured as a cop bashes his head in with a shield, he's then shoved and shot.",02/06/2020,4,52,44.4,44.4,882.6992371321866,319.67738299312504,397.4742135122994,131.57125320768586,0.0,0.0
133,133,133,"Washington D.C., USA",06/02/2020,02:46:00,06/01/2020,https://twitter.com/Urquwill/status/1267618648203689985 ,38.8995369,-77.0387429,Less Lethal Round,"High-def footage of the indiscriminate use of Stinger grenades and other ordnance by DC law enforcement.  A grenade explodes at mid-height in front of a civilian. 

Excerpted from the incident above ",02/06/2020,4,52,44.4,44.4,826.5356206533381,320.70022907135575,184.40904999941634,211.17361257229035,0.0,0.0
134,134,134,"Omaha, NE, USA",06/02/2020,03:30:00,,https://twitter.com/reecereports/status/1267629669093978117,41.255378,-95.933341,Less Lethal Round,"Police officers shoot civilians with pepperballs, kick them, and arrest them.",02/06/2020,4,5,44.4,44.4,565.1674089568156,256.3012868031037,184.66898318762878,174.93113711910107,0.0,0.0
135,135,135,"Dallas, TX, USA",06/02/2020,04:00:00,,https://twitter.com/greg_doucette/status/1268682435442741254,32.780071,-96.82224599999999,Tear Gas,"Video montage showing use of tear gas, rubber bullets, and arrest of peaceful protestors by police officers.",02/06/2020,4,9,44.4,44.4,528.2833478780093,429.00019268905555,736.463604819639,245.38939148208655,0.0,0.0
136,136,136,"Washington D.C., USA",06/02/2020,04:05:00,,https://twitter.com/nytimes/status/1267638330654625794,38.900188,-77.036857,Tear Gas,Police officers (+ associated forces) use flashbangs and tear gas to clear out civilians around St John's Church for President Trump to have a photo op.,02/06/2020,4,52,44.4,44.4,844.7909018573098,335.77050363970847,753.7486865866157,187.02774561263897,0.0,0.0
137,137,137,"Washington D.C., USA",06/02/2020,04:06:00,,https://twitter.com/KannoYoungs/status/1267638764056313857,38.89614,-77.019882,Intimidation,Military helicopters hover low over crowds of civilians. ,02/06/2020,4,52,44.4,44.4,925.535461887238,357.6905991664511,436.220249076733,480.7050786905622,0.0,0.0
138,138,138,"Los Angeles, CA, USA",06/02/2020,04:22:00,,https://twitter.com/dannychun/status/1267642764583264256,34.204572999999996,-118.448844,Arrest/Detention,Police officers arrest store owners rather than looters.,02/06/2020,4,15,44.4,44.4,148.62756787921558,358.745506912115,962.0030565659664,267.58573868463264,0.0,0.0
139,139,139,"Columbus, OH, USA",06/02/2020,04:29:00,06/01/2020,https://twitter.com/TheLantern/status/1267644471317090305,40.00595300000001,-83.00908199999998,Pepper Spray,Police officers pepper spray protestors and reporters.,02/06/2020,4,0,44.4,44.4,793.9929737580999,245.57804833290768,155.21638800136677,478.91732355821864,0.0,0.0
140,140,140,"Riverside, CA, USA",06/02/2020,04:46:00,,https://twitter.com/rozr31_rose/status/1267648785242439680,33.981425,-117.37342199999999,Other,Police officers filmed smashing windows of a parked car as they respond to protest.,02/06/2020,4,54,44.4,44.4,238.4740327697572,405.23092690916025,947.7872328446948,529.4236315909087,0.0,0.0
141,141,141,"Philadelphia, PA, USA",06/02/2020,04:46:40,,https://www.instagram.com/p/CA6pxvzgLAS/?utm_source=ig_web_copy_link,40.003,-75.166106,Physical Assault,"Several officers run after two civilians, whilst hitting them aggresively with batons. One of the civilians is in an open-top vehicle. The officer continues to strike them overhead, smashing the windows of the vehicle in the process. The civilian in the vehicle drives away whilst the other civilian is detained on the floor.   ",02/06/2020,4,23,44.4,44.4,863.4824478444883,233.85041835110852,417.66558035030585,136.92168345676342,0.0,0.0
142,142,142,"Richmond, VA, USA",06/02/2020,04:52:00,,https://twitter.com/Justiceaddwater/status/1267650345947271176,37.553909999999995,-77.46000500000002,Tear Gas,Police officers use tear gas against civilians half-an-hour before curfew.,02/06/2020,4,34,44.4,44.4,837.8128699260074,354.33370252117123,743.5498532004713,146.74354801846096,0.0,0.0
143,143,143,"Bentonville, AR, USA",06/02/2020,05:17:00,,https://twitter.com/peyjobe/status/1267656498525753344,36.372461,-94.20815999999999,Tear Gas,"Tear gas used on peaceful crowd chanting ""we want peace.""",02/06/2020,4,55,44.4,44.4,588.274581677862,362.59913833730053,644.6369598550115,212.78347489320527,0.0,0.0
144,144,144,"Des Moines, IA, USA",06/02/2020,05:45:00,,https://twitter.com/aaronpcalvin/status/1268708285517004801,41.5902914,-93.61376829999999,Arrest/Detention,Police conduct a violent raid on a LGBT bar.,02/06/2020,4,50,44.4,44.4,608.004253832334,257.5651571542513,956.0566370324971,240.08072200514366,0.0,0.0
145,145,145,"Philadelphia, PA, USA",06/02/2020,05:49:00,,https://twitter.com/balleralert/status/1267664589279371267,40.0024133,-75.2584571,Physical Assault,"6 PPD police officer arrest a civilian and beat them on the ground.  Civilian: ""I can't breathe!""  Officer: ""SHUT UP ASSHOLE! ARE YOU FUCKING STUPID? SHUT UP! THAT SHIT DON'T WORK HERE!"".",02/06/2020,4,23,44.4,44.4,903.8100588202464,251.83634809730205,479.1607443168278,237.84733270322764,0.0,0.0
146,146,146,"Salt Lake City, UT, USA",06/02/2020,06:21:00,,https://twitter.com/Leashie3/status/1267672607198855169,40.775539,-111.888167,Physical Assault,"It is after curfew. A civilian converses with officers, but as they turn to walk away an officer pushes them and takes them down to the floor. The civilian is then held down and restrained on the floor by multiple officers whilst a line of officers stand in front, obscuring view. ",02/06/2020,4,18,44.4,44.4,276.9661324440688,251.5114329553853,354.8225227710962,265.6516805560299,0.0,0.0
147,147,147,"Seattle, WA, USA",06/02/2020,06:24:00,,https://twitter.com/_christopher/status/1267673530432356357,47.615401,-122.31908600000001,Tear Gas,Reporter hit by a tear-gas cannister live on air.,02/06/2020,4,20,44.4,44.4,74.86459256605535,69.7825237463914,676.6651962849099,198.98277381798798,0.0,0.0
148,148,148,"Kalamazoo, MI, USA",06/02/2020,06:40:00,06/01/2020,https://twitter.com/osnapitzperi/status/1267677463850745858,42.291588899999994,-85.5851463,Tear Gas,Protestors lay on the ground and officers start shooting teargas canisters at their heads.,02/06/2020,4,56,44.4,44.4,743.3953568620404,212.00548140883745,727.6538521268475,215.8820436507203,0.0,0.0
149,149,149,"Los Angeles, CA, USA",06/02/2020,07:11:00,,https://twitter.com/ricci_sergienko/status/1267685230799777793,34.071847,-118.362168,Physical Assault,"Police officers shoving peaceful civilians backwards with their batons, and fire less lethal rounds.",02/06/2020,4,15,44.4,44.4,123.14034683293461,413.71942219391644,359.7536703722479,245.52955276449052,0.0,0.0
150,150,150,"Los Angeles, CA, USA",06/02/2020,07:14:00,,https://twitter.com/withlovecole/status/1267692703866740737 ,34.100784000000004,-118.325177,Other,"Police aim their guns at civilians recording on their phones from the balconies of their homes. , 

Another angle of the incident above",02/06/2020,4,15,44.4,44.4,164.5354363701805,373.0036641098539,967.8746696445144,542.2553236177944,0.0,0.0
151,151,151,"Los Angeles, CA, USA",06/02/2020,07:23:00,,https://twitter.com/AdoreDelano/status/1267688320735166465,34.101673600000005,-118.324325,Arrest/Detention,"A civilian live-streams their walk home and is arrested by police. On the livestream the officers radio can be heard saying: ""You should not be driving past anyone. Stop where you are, and take someone into custody.""",02/06/2020,4,15,44.4,44.4,171.28072527343528,352.3900819277942,943.9838651375262,256.78356316977636,0.0,0.0
152,152,152,"Des Moines, IA, USA",06/02/2020,07:48:00,,https://twitter.com/katie_akin/status/1267694434847731713,41.591190999999995,-93.605005,Pepper Spray,Police officers intimidate and pepper-spray a journalist who repeatedly identifies that they are a journalist.,02/06/2020,4,50,44.4,44.4,612.3058766316158,235.99136804197798,134.5900983425675,513.7456218738566,0.0,0.0
153,153,153,"Oakland, CA, USA",06/02/2020,07:49,,https://twitter.com/LilCocoBabe/status/1267694711952699393,37.800208700000006,-122.2737406,Tear Gas,Oakland Police fire tear gas on civilians ,02/06/2020,4,57,44.4,44.4,76.80994594567363,340.73592559418483,651.6178708332541,176.18198699868475,0.0,0.0
154,154,154,"Oakland, CA, USA",06/02/2020,07:53,,https://twitter.com/byjacobward/status/1267695808784199680,37.8002747,-122.2739628,Tear Gas,Street-level view of 441 above moments before tear-gas is fired on civilians,02/06/2020,4,57,44.4,44.4,69.75052526490462,319.89904145630015,693.957664458751,125.11723142304022,0.0,0.0
155,155,155,"San Luis Obispo, CA, USA",06/02/2020,08:01:00,,https://twitter.com/ma7dz/status/1267697838244298752,35.28590170000001,-120.662782,Tear Gas,Police fire tear-gas on civilians with their hands raised. ,02/06/2020,4,58,44.4,44.4,104.28189973514404,383.1999595864524,672.1251165548847,178.87812130781384,0.0,0.0
156,156,156,"Seattle, WA, USA",06/02/2020,11:58:00,,https://twitter.com/LucasENystrom/status/1267757417850421249,47.61529,-122.31801599999999,Pepper Spray,Police officers pepper-spray civilians and then shoot flash-bangs into a chanting crowd.,02/06/2020,4,20,44.4,44.4,131.75251479235985,99.85569065443127,61.1306797237415,508.6289488812631,0.0,0.0
157,157,157,"Cincinatti, OH, USA",06/02/2020,12:23:00,,https://twitter.com/gwstoulouse/status/1267673147937038336,39.106163,-84.514997,Arrest/Detention,"Police arrest a black business owner for painting on the windows of his own business. Cincinnati's curfew included an exemption for work-related activity.

More footage of 446 out of Cincinnati OH, where police arrested a black business owner for a curfew violation while he was working (an exemption to curfew).  Turns out a cop blocked him from going back inside as they demanded.",02/06/2020,4,39,44.4,44.4,759.9235904680644,323.1912200565399,1009.6442002526851,168.79764679469855,0.0,0.0
158,158,158,"Pittsburgh, PA, USA",06/02/2020,15:54:00,06/01/2020,https://twitter.com/messiest_headd/status/1267816842413740034,40.457382,-79.933316,Pepper Spray,Officers pepper-spray two people on their knees with their hands up. ,02/06/2020,4,53,44.4,44.4,831.1562659963936,279.5532799395482,116.86163293194923,502.26450737187923,0.0,0.0
159,159,159,"Washington D.C., USA",06/02/2020,17:21:00,,https://twitter.com/EdFelten/status/1267838832298393602,38.9024539,-77.02403609999998,Other,Police leave unexploded stinger laying around in the public park greenery. Object is identified as an improvised explosive device (IED). ,02/06/2020,4,52,44.4,44.4,873.6616862891161,279.2837375822449,1045.8453457525002,515.5302079787879,0.0,0.0
160,160,160,"Philadelphia, PA, USA",06/02/2020,17:31:00,06/02/2020,https://twitter.com/d0wnrrrrr/status/1267841238381858816,39.959315999999994,-75.17356,Pepper Spray,"Police officer pulls down a civilian's mask to pepper spray the person in the face, pepper sprays a second individual, and kicks a third over.",02/06/2020,4,23,44.4,44.4,917.3286514278041,302.0494632602717,115.98066288875582,543.5873498431108,0.0,0.0
161,161,161,"New York City, NY, USA",06/02/2020,20:30:00,,https://www.thedailybeast.com/even-medical-workers-fighting-covid-say-cops-are-attacking-them-at-george-floyd-protests?ref=home,40.651436600000004,-73.96504709999998,Physical Assault,Police officers physically assult a hospital worker as the worker records police chasing after someone near the Church Avenue subway station.  The hospital worker has to get stitches and two CT scans at the hospital where they work because of the assualt.,02/06/2020,4,3,44.4,44.4,939.3238381905808,296.68564091299424,421.1073022046357,156.45140002756435,0.0,0.0
162,162,162,"Worcester, MA, USA",06/02/2020,21:18:00,06/01/2020,https://twitter.com/sebishop99/status/1267913459938844673?s=20,42.25139,-71.82028000000003,Less Lethal Round,"A row of police officers open fire at people, who seem seem to be at a distance of 100 metre and continue to move away from police officers. The source claims that police officers used pepper guns. ",02/06/2020,4,59,44.4,44.4,989.3480702568731,199.84406239515872,125.8690729196772,271.73434909739836,0.0,0.0
163,163,163,"Worcester, MA, USA",06/02/2020,22:37:00,06/01/2020,https://twitter.com/sebishop99/status/1267933307762851846,42.25180200000001,-71.819163,Tear Gas,Video shows a street in residential area covered in tear gas and camera person struggeling to breath. ,02/06/2020,4,59,44.4,44.4,1009.8153589828744,209.0768766382814,709.3559553991056,252.65477414060211,0.0,0.0
164,164,164,"Walnut Creek, CA, USA",06/02/2020,22:53:00,,https://twitter.com/agnosticspirit/status/1267922192022384640,37.901760100000004,-122.0619202,Tear Gas,Police deploy teargas and bullets on a peaceful protesters.,02/06/2020,4,60,44.4,44.4,106.06279277237708,305.4173265297394,663.7055331542466,273.8554786354038,0.0,0.0
165,165,165,"Austin, TX, USA",06/02/2020,,05/30/2020,https://www.youtube.com/watch?v=-BGyTi-KdKc&feature=youtu.be,30.268117100000005,-97.73333620000001,Less Lethal Round,"Police shoot a 16-year-old civilian in the head with a bean bag round. ,

A view of the incident from a distance.",02/06/2020,4,31,44.4,44.4,551.4787999073836,475.7192029046589,61.20338787668646,140.4421669854603,0.0,0.0
166,166,166,"Annandale, VA, USA",06/02/2020,,,https://www.youtube.com/watch?v=tvUI6D-LWcE&feature=youtu.be,38.8330283,-77.1595725,Physical Assault,A police officer beats someone at a gas station as they lie on the ground.,02/06/2020,4,61,44.4,44.4,919.841933024313,320.0515475049799,469.6686700736648,217.06373448225202,0.0,0.0
167,167,167,"Hoover, AL, USA",06/03/2020,01:58:00,,https://twitter.com/IanHoppe/status/1267968991424909312,33.3877847,-86.8065105,Arrest/Detention,A small group of high school students and other civilians sitting on grass in front of Hoover City Hall are surrounded by around 50 police officers in riot gear. 14 civilians were then taken into police custody for violating the 7pm curfew but were ultimately not charged.,03/06/2020,5,44,44.4,44.4,717.7071467842765,445.0162767886745,988.9924121277634,265.40859831933614,0.0,0.0
168,168,168,"Asheville, NC, USA",06/03/2020,02:19:00,,https://twitter.com/AngelaMWilhelm/status/1267974081577717762,35.594901899999996,-82.5522824,Other,"Asheville Police surround a medic station as they stab water bottles with knives and tip over tables of medical supplies and food. The medic team, made of EMTs and doctors, said the medical station was approved by the city. ,

Glenna Grant, a medic, reporting what happened in the incident, adding that the police officers came in with full riot gear and hit the medical team volunteers with shields. The 10-12 medics present were all clearly marked as such and did not provoke police in any way. They lost at least $700 in supplies.",03/06/2020,5,62,44.4,44.4,799.1360669028508,368.8231153009237,1049.9849617355887,490.2802779428976,0.0,0.0
169,169,169,"Colorado Springs, CO, USA",06/03/2020,02:21:00,06/01/2020,https://krdo.com/news/top-stories/2020/06/02/cspd-reviewing-arrest-after-video-shows-officers-repeatedly-punch-suspect-at-protest/,38.828285,-104.82204200000001,Less Lethal Round,Police officers fire less-lethal rounds and repeatedly punch a civilian as they make an arrest.,03/06/2020,5,63,44.4,44.4,403.77799411475996,322.0368603999812,83.67049675970016,175.27993072264226,0.0,0.0
170,170,170,"Detroit, MI, USA",06/03/2020,02:58:00,,https://twitter.com/MedvisJackson/status/1267984069905784832,42.33293915,-83.0478363,Intimidation,"Police officers continually using sirens, and blocking the road.",03/06/2020,5,7,44.4,44.4,776.0355504798673,215.35090590557118,408.31278583179454,529.2158218416179,0.0,0.0
171,171,171,"Clayton, NC, USA",06/03/2020,04:05:00,06/02/2020,https://twitter.com/CliffBraun/status/1268038070667849728 ,37.940512,-121.93648590000002,Less Lethal Round,"Distance view of police opening fire on kids for curfew violations , 

Field-level view of the incident above in Clayton CA",03/06/2020,5,64,44.4,44.4,113.40463652582451,326.17033085069335,109.94761191348573,289.4819195248625,0.0,0.0
172,172,172,"Philadelphia, PA, USA",06/03/2020,04:07:00,06/03/2020,https://twitter.com/tippedminimum/status/1268001268406136832,39.951576,-75.156725,Physical Assault,Police officers grab an individual speaking to them and then assault people who come forward shouting 'why do you always start the violence?',03/06/2020,5,23,44.4,44.4,934.3345501516053,337.29303508697717,458.7110119769084,164.61115981401935,0.0,0.0
173,173,173,"Orlando, FL, USA",06/03/2020,04:15:00,,https://twitter.com/ewcfilms/status/1268003421786906627,28.54017,-81.3849276,Physical Assault,A civilian in the crowd is grabbed by the police and then encircled by a group of officers. The other officers then pepper-spray everyone in the crowd.,03/06/2020,5,22,44.4,44.4,790.0186971537054,506.74193031177225,435.36670409482684,126.05273748436093,0.0,0.0
174,174,174,"Charlotte, NC, USA",06/03/2020,04:21:00,,https://twitter.com/katie_levans/status/1268004903257100302 ,35.21874589999999,-80.8373319,Other,"Police surrounded civilians near a parking garage and begun shooting flashbangs, pepper balls and tear gas unprovoked. Excerpted from @queencitynerve livestream. ,

Another angle of the incident ",03/06/2020,5,65,44.4,44.4,821.4533413392737,414.5031996192511,996.1132146331012,469.73343337439326,0.0,0.0
175,175,175,"San Jose, CA, USA",06/03/2020,04:25:00,,https://twitter.com/veronica_d19/status/1268005920274935808,37.335547999999996,-121.88584709999999,Physical Assault,Police officer hits a civilian with their motorcycle and send the civilian to the ground as 3 more police officers pile on.,03/06/2020,5,17,44.4,44.4,107.62236770235573,361.9483246229534,345.5393407051076,227.53259949567445,0.0,0.0
176,176,176,"Orlando, FL, USA",06/03/2020,04:46:00,,https://twitter.com/kailakerouac/status/1268011180989337602,28.540206400000002,-81.3836163,Other,7-8 police officers pile ontop of an injured civilian who was already on the ground not resisting.,03/06/2020,5,22,44.4,44.4,826.0999821258861,524.5969544489435,1025.5356239971281,520.463717295806,0.0,0.0
177,177,177,"New York City, NY, USA",06/03/2020,04:57,,https://twitter.com/mingum/status/1268013932423372800,40.71304703,-74.00723267,Physical Assault,Police officers beat a civilian and take away his bicycle,03/06/2020,5,3,44.4,44.4,877.8244431879257,219.1690674875009,485.23907975084745,199.86185805032483,0.0,0.0
178,178,178,"Los Angeles, CA, USA",06/03/2020,05:07:00,,https://twitter.com/GadiNBC/status/1268016449320177665,34.0916899,-118.31090630000001,Arrest/Detention,"At least 6 cops destroy a car, breaking out its windows to drag out the occupants.",03/06/2020,5,15,44.4,44.4,180.54325246860168,388.24758230116873,988.9041167846615,133.15256719004327,0.0,0.0
179,179,179,"San Diego, CA, USA",06/03/2020,05:10:00,,https://twitter.com/jessiepridemore/status/1268017181003939841,32.715634200000004,-117.1658346,Less Lethal Round,"Police officer shoots into a group of civilians after they are boxed in and forced towards the officers in line. Despite pleas from civilians to not shoot, the police officer does so anyway. ",03/06/2020,5,33,44.4,44.4,176.0464575952661,475.9580960878027,66.57223602443368,273.17756828873854,0.0,0.0
180,180,180,"Los Angeles, CA, USA",06/03/2020,05:40:00,,https://twitter.com/AsToldBySam/status/1268024653466877952?s=20,34.047389,-118.251347,Intimidation,A police officer is pointing their gun up at a building and appears to be aiming at the individual who is filming from their window.,03/06/2020,5,15,44.4,44.4,197.41914723914047,418.0325671051771,345.49724340752005,487.4946092558816,0.0,0.0
181,181,181,"New York City, NY, USA",06/03/2020,05:43:00,,https://twitter.com/greg_doucette/status/1268025470764888066,40.71304703,-74.00723267,Physical Assault,4-5 NYPD police officers assault a civilian who was protecting another civilian. ,03/06/2020,5,3,44.4,44.4,886.5191756736156,199.02399954625116,459.17070981152773,235.03251116766367,0.0,0.0
182,182,182,"San Antonio, CA, USA",06/03/2020,05:54:00,,https://twitter.com/SanAntonioProbz/status/1268028294529798144,37.79466629,-122.240242,Less Lethal Round,"Individual leading a group of protestors said, ""Everybody put your hands up!"" Then the police open fire into the crowd. ",03/06/2020,5,66,44.4,44.4,91.52974845136711,321.84137605101824,46.13226786756877,269.1533073252281,0.0,0.0
183,183,183,"Costa Mesa, CA, USA",06/03/2020,06:37:00,,https://www.reddit.com/r/orangecounty/comments/gvn42k/oc_sheriff_deputy_forgoing_his_name_badge_to_wear/?utm_source=share&utm_medium=ios_app&utm_name=iossmf,33.6635953,-117.9048183,Other,"An Orange County deputy replaced his name badge with III%er / Oathkeeper patch. This is a symbol associated to the right-wing, extremist Three-Percenter militia group.",03/06/2020,5,67,44.4,44.4,209.6137427284431,436.7369188460307,977.7937182059342,459.3983992972823,0.0,0.0
184,184,184,"Dallas, TX, USA",06/03/2020,06:45:00,,https://twitter.com/greg_doucette/status/1268041199077728256 ,32.778985999999996,-96.7967878,Less Lethal Round,"Police shot out the left eye of 25 year old Brandon Saenz with a ""less lethal round"". ",03/06/2020,5,9,44.4,44.4,544.1058495685188,413.7167995750124,154.80470588237577,237.38412728725962,0.0,0.0
185,185,185,"Tampa, FL, USA",06/03/2020,06:47:00,,https://twitter.com/Bluntraps/status/1268041549109170177,27.949324,-82.45577800000002,Tear Gas,Peaceful protestors teargassed and arrested by police. ,03/06/2020,5,42,44.4,44.4,799.3282627346738,563.6286185816238,746.5840291750922,167.48995649453187,0.0,0.0
186,186,186,"Portland, OR, USA",06/03/2020,07:12:00,,https://twitter.com/MrOlmos/status/1268047948341886977,45.5186006,-122.6960515,Tear Gas,Indiscriminate teargas and flash-bang grenade use against group of protestors. ,03/06/2020,5,68,44.4,44.4,31.338508429067936,129.72624030181768,705.7509850762125,163.62802021048768,379.45683381960737,60.38841174580099
187,187,187,"Washington D.C., USA",06/03/2020,07:22:00,06/03/2020,https://twitter.com/MarkIronsMedia/status/1268046417865715713,38.900197999999996,-77.036563,Tear Gas,"Police officers (presumably, as they're unidentifiable) shoot tear gas and less lethal rounds at civilians who run away.",03/06/2020,5,52,44.4,44.4,845.649937969896,316.0190118418574,697.3399492620193,200.36521833078078,0.0,0.0
188,188,188,"Portland, OR, USA",06/03/2020,07:27:00,,https://twitter.com/45thabsurdist/status/1268051610942320640,45.5186395,-122.67892020000001,Less Lethal Round,Police shoot into a crowd of civilians multiple times for no apparent reason.,03/06/2020,5,68,44.4,44.4,92.72039641938618,110.85429427322394,61.85701364226965,160.8912592368884,345.06298771136176,72.25227437639676
